date,headline,summary,source,relevance,entities
2025-06-16,"Tesla price hikes, Roku–Amazon, Hinge Health analyst coverage","Wealth host Brad Smith tracks today’s top moving stocks and biggest market stories in this Market Minute. Tesla (TSLA) announced price increases on its Model S and Model X by $5,000. The company also teased robotaxi rollout plans for this weekend. Roku (ROKU) is gaining on news that the company will partner with Amazon (AMZN) Ads, giving marketers exclusive access to 80 million US TV households. Hinge Health (HNGE) pops after analysts initiated coverage with a bullish outlook. Stay up to date on the latest market action, minute-by-minute, with Yahoo Finance's Market Minute.",Yahoo,0.0584,"['Tesla', 'Roku', 'Amazon', 'Hinge Health', 'Tesla', 'TSLA', 'Roku', 'ROKU', 'Amazon', 'AMZN', 'Hinge Health', 'HNGE', ""Yahoo Finance's""]"
2025-06-16,Is Tesla's Robotaxi Dream Just 'Hopium' for TSLA Investors?,"Waymo is off to an early lead over Tesla in the Robotaxi wars. However, Tesla has significant advantages in terms of cost, scalability, and autonomous technology. Can Elon Musk and his team catch up?",Yahoo,0.2876,"['Tesla', 'TSLA', 'Waymo', 'Tesla', 'Tesla']"
2025-06-16,Tesla (TSLA)’s Strength in AI and Robotics Drives Morgan Stanley’s Bullish Outlook,"Tesla, Inc. (NASDAQ:TSLA) is one of the 12 AI Stocks Every Investor is Watching. On June 13, Morgan Stanley reiterated the stock as “Overweight,” stating that the stock remains extremely well positioned in “data, robotics, energy, AI, manufacturing, and supporting infrastructure.” “While there are a growing number of US efforts to push the boundaries of physical AI, we […]",Yahoo,0.3994,"['Tesla', 'TSLA', 'Morgan Stanley’s', 'Tesla, Inc.', 'NASDAQ', 'TSLA', 'Morgan Stanley']"
2025-06-18,Reality Check On Tesla's Non-Auto Businesses,"Tesla, Inc.'s robotaxi and humanoid robot ventures face challenges and overhyped valuations. Click for why TSLA stock expectations differ from realistic projections.",SeekingAlpha,0.2481,"['Tesla', ""Tesla, Inc.'s"", 'TSLA']"
2025-06-18,Tesla (TSLA) to Halt Gigafactory Texas Output Again Amid Inventory Pressure,Production pause for Model Y and Cybertruck marks second shutdown in two months,Yahoo,0.5,"['Tesla', 'TSLA']"
2025-06-18,Tesla Cybertruck Caught Driving In Wrong Lane On FSD—Just Days Before Robotaxi Launch,"Tesla Inc.'s (NASDAQ:TSLA) FSD or Full Self-Driving technology is under scrutiny again as a new video surfaced online that showcases a Cybertruck driving in the wrong lane, ahead of the Robotaxi launch on June 22. What Happened: ""I use FSD for over 2 hours of travel every day around the Philadelphia area and have never experienced an issue as bad as this one,"" a user on social media platform X said with a video on Sunday. The video showcased a Cybertruck on supervised FSD driving down the road.",Yahoo,0.1658,"['Tesla', ""Tesla Inc.'s"", 'NASDAQ', 'TSLA', 'X']"
2025-06-18,Why the Market Dipped But Tesla (TSLA) Gained Today,"Tesla (TSLA) reached $321.99 at the closing of the latest trading day, reflecting a +1.78% change compared to its last close.",Yahoo,0.5,"['Tesla', 'TSLA', 'Tesla', 'TSLA']"
2025-06-19,Tesla Will Shut Down Production At The Texas Gigafactory Over The 4th Of July Weekend,"Tesla Inc. (NASDAQ:TSLA) will shut down production at the Texas Gigafactory, which manufactures the Cybertruck and the Model Y, over the Independence Day weekend. What Happened: The planned shutdown would begin on June 30, which was decided after a meeting with workers at the factory. All production activities would begin the following week, Business Insider reported on Tuesday. The report suggests that the halt would help Tesla carry out some maintenance work on its production line. This is the",Yahoo,0.1658,"['Tesla', 'Tesla Inc.', 'TSLA', 'Business Insider', 'Tesla']"
2025-06-20,"Barclays sees Tesla Q2 deliveries at 375,000, below consensus","Investing.com -- Barclays expects Tesla (NASDAQ:TSLA) to report second-quarter deliveries of approximately 375,000 vehicles, falling short of the consensus estimate of around 400,000 units and representing a 10% year-over-year decline.",Yahoo,0.1416,"['Barclays', 'Tesla', 'Barclays', 'Tesla', 'TSLA']"
2025-06-20,Tesla (TSLA) Stock Rated Overweight as Robotaxi Launch Nears,"Tesla, Inc. (NASDAQ:TSLA) is one of the 10 AI Stocks Getting Wall Street’s Attention. On June 16, Cantor Fitzgerald analyst Andres Sheppard reiterated an “Overweight” rating on the stock with a $355.00 price target. The rating affirmation comes as Tesla continues to test its unsupervised self-driving Model Y vehicles in Austin, Texas. This testing comes ahead of its […]",Yahoo,0.5,"['Tesla', 'TSLA', 'Tesla, Inc.', 'TSLA', 'Cantor Fitzgerald', 'Tesla']"
2025-06-20,"Futures waver, triple witching, Tesla robotaxis: 3 Things","Here are some of the stories Wall Street is watching on Friday, June 20. Stock futures (ES=F, NQ=F, YM=F) are wavering after President Trump set a two-week deadline to decide what to do about the Iran-Israel conflict. About $6.5 trillion worth of options are expiring today, which could set up for a volatile day of trading. Tesla's (TSLA) robotaxis are scheduled to launch in Austin this weekend. To watch more expert insights and analysis on the latest market action, check out more Morning Brief here.",Yahoo,0.2481,"['Tesla', 'Tesla', 'TSLA']"
2025-06-20,"Dear Tesla Stock Fans, Mark Your Calendars for June 30",Tesla reportedly plans on temporarily suspending production of the Cybertruck and Model Y at its Austin factory starting on June 30. Here’s what the pause may mean for TSLA stock.,Yahoo,0.2481,"['Tesla', 'Tesla', 'TSLA']"
2025-06-20,This Options Tool Can Show You How to Trade Tesla Stock Ahead of Robotaxi Day,"The autonomous vehicle race is heating up as TSLA preps for its Robotaxi launch in Austin. Learn the key players in the AV race, and see which price points are in play for Tesla stock right now.",Yahoo,0.2481,"['Tesla', 'TSLA', 'Tesla']"
2025-06-20,4 Top Robotics Stocks to Watch in the Second Half of 2025,"Robotics is poised for robust growth in the second half of 2025. Watch AMD, TSLA, CDNS and SERV that are poised to dominate the market.",Yahoo,0.25,"['AMD', 'TSLA', 'CDNS', 'SERV']"
2025-06-20,Tesla's robotaxi rollout kicks off 'next phase' of self-driving,"Tesla (TSLA) is expected to roll out robotaxis in Austin, Texas over the weekend. Envorso vice president of data, analytics, and AI Ken Johnston joins Morning Brief to discuss what the launch event means for Tesla. To watch more expert insights and analysis on the latest market action, check out more Morning Brief here.",Yahoo,0.1422,"['Tesla', 'Tesla', 'TSLA', 'Envorso', 'Morning Brief', 'Tesla']"
2025-06-20,The ‘Golden Era’ for Tesla Starts June 22. Should You Buy TSLA Stock First?,Wedbush says Tesla stock could hit a $2 trillion market cap on the back of its upcoming robotaxi services. Dan Ives continues to see upside in TSLA shares to $500.,Yahoo,0.4292,"['Tesla', 'TSLA', 'Wedbush', 'Tesla', 'TSLA']"
2025-06-20,Tesla (NasdaqGS:TSLA) Expands Into Indian Market With First Showrooms Opening In July,"Tesla (NasdaqGS:TSLA) marked a significant milestone with a 29% increase in its share price over the last quarter, aligning with broader market trends despite facing challenges. The announcement of opening its first showrooms in India represents a substantial step into a key market, potentially boosting investor sentiment. Meanwhile, the resignation of a key executive and the inclusion of a new board member might have created mixed reactions, though these were countered by expanded market...",Yahoo,0.5,"['Tesla', 'TSLA', 'Tesla', 'TSLA']"
2025-06-20,"Before The Mars Dream And Multi-Billion Dollar Ventures, Elon Musk Just Wanted A Job At Netscape—Here's What He Told The AI Generation About That","Speaking to young founders at Y Combinator's AI Startup School in San Francisco earlier this week, Tesla Inc. (NASDAQ:TSLA) Elon Musk shared raw, humorous and insightful reflections on his early startup journey—and why rejection shaped his mission to build the future. What Happened: In a fireside chat with Y Combinator CEO Garry Tan, Musk revisited his 1995 decision to drop out of Stanford University's PhD program and take a gamble on the internet—then a largely unknown frontier. Musk admitted h",Yahoo,0.1245,"['Netscape', ""Y Combinator's"", 'Tesla Inc.', 'NASDAQ', 'TSLA', 'Y Combinator', ""Stanford University's""]"
2025-06-20,"Tesla Sues Ex-Engineer's Startup Over Alleged Theft Of Billion-Dollar Robot Tech: 'Defendants Took A Shortcut: Theft,' Musk's Company Says","Tesla (NASDAQ:TSLA) has filed a federal lawsuit against former engineer Zhongjie ""Jay"" Li, alleging that he stole trade secrets tied to the company's ambitious Optimus humanoid robot program, and used them to launch a competing Silicon Valley startup, Bloomberg reports. The lawsuit, filed June 11 in the U.S. District Court for the Northern District of California, claims Li downloaded proprietary data related to Optimus’s robotic hand systems just before leaving Tesla in September. According to t",Yahoo,0.1422,"['Tesla', 'Tesla', 'TSLA', 'Bloomberg', 'District Court', 'Tesla']"
2025-06-20,Don't expect to see Tesla robotaxis everywhere just yet,"Tesla's (TSLA) robotaxis are expected to hit the street this weekend in Austin, Texas. Stifel NextGen Transport analyst Stephen Gengaro says that investors shouldn't expect to see a slew of robotaxis hitting the roads across America just yet. Find out why in the video above. To watch more expert insights and analysis on the latest market action, check out more Market Domination here.",Yahoo,0.1988,"['Tesla', 'Tesla', 'TSLA', 'Stifel NextGen Transport']"
2025-06-21,Where Will Tesla Be in 10 Years?,"Robotaxis could revolutionize Tesla's business.  Tesla (NASDAQ: TSLA) is now one of the largest companies in the world, with a market cap of more than $1 trillion.  In fact, over the next 10 years, there's a brand new business segment that could be worth more than $1 trillion on its own.",Yahoo,0.1658,"['Tesla', 'Tesla', 'Tesla', 'NASDAQ', 'TSLA']"
2025-06-21,Tesla plans $8 billion U.S. investment this fiscal year,"Investing.com -- Tesla (NASDAQ:TSLA) announced plans to invest approximately $8 billion in United States infrastructure and manufacturing during the current fiscal year, according to a post on X on late Friday.",Yahoo,0.1988,"['Tesla', 'Tesla', 'TSLA', 'X']"
2025-06-21,Meet the nine private humanoid robot firms shaping the future,"The humanoid robot arms race is on, and it’s not just Tesla Inc (NASDAQ:TSLA) making noise with its Optimus humanoid—the real action is happening among a new generation of private players, each betting big on a future where humanoids are everywhere from factory floors to your living room, according to UBS analysts.",Yahoo,0.3333,"['Tesla Inc', 'TSLA', 'UBS']"
2025-06-21,Tesla vs. Waymo: What is the difference between the vehicles?,"Tesla's robotaxis are set to hit the streets of Austin, Texas. When it comes to self-driving vehicles, the EV giant faces stiff competition from the Alphabet-backed Waymo (GOOG, GOOGL), which already has vehicles on the roads in several cities, one of which may soon be New York City. Stifel NextGen Transport analyst Stephen Gengaro has ridden in both vehicles. He shares his key takeaways from his experiences and why, ultimately, Tesla (TSLA) may have a leg up on the rival. To watch more expert insights and analysis on the latest market action, check out more Market Domination here.",Yahoo,0.0904,"['Tesla', 'Waymo', 'Tesla', 'Alphabet', 'Waymo', 'GOOG', 'Stifel NextGen Transport', 'Tesla', 'TSLA']"
2025-06-21,Tesla (NasdaqGS:TSLA) Set To Enter Indian Market With First Showrooms In July,"Tesla (NasdaqGS:TSLA) is set to make a significant shift, entering the Indian market in July 2025 with new showrooms. This expansion comes at a time when the company's stock price rose by 30% over the last quarter, amid flat market performance in the past week and a 10% rise over the past year. The entry into India is aimed at countering declining sales in Europe and China, which could have influenced investor sentiment. Despite challenges such as a recent lawsuit and executive changes, this...",Yahoo,0.5,"['Tesla', 'TSLA', 'Tesla', 'TSLA']"
2025-06-22,Should The Government Be Run Like A Business? Robert Reich Says 'Trump Sucks At Running Businesses',"Billionaire and Tesla (NASDAQ:TSLA) CEO Elon Musk argued in March that if a commercial company operated like the U.S. federal government, it “would go immediately bankrupt.” But economist and former U.S. Labor Secretary Robert Reich says that’s exactly the point—the government isn’t a business and shouldn’t be run like one. Government Is About People, Not Profits Musk: If a commercial company operated the way the federal government does, then it would be — immediately go bankrupt. It would be de",Yahoo,0.25,"['Tesla', 'NASDAQ', 'TSLA', 'Labor']"
2025-06-23,Tesla Begins Offering Robotaxi Rides in Texas as Wedbush Sees Autonomous Opportunities,"Tesla (TSLA) started offering rides in its Robotaxis on Sunday in Texas, with Wedbush Securities ana",Yahoo,0.1416,"['Tesla', 'Wedbush', 'Tesla', 'TSLA', 'Wedbush Securities']"
2025-06-23,"US-Iran, Powell to testify, Tesla's robotaxi: 3 Things","Here are three of the stories Wall Street is watching on Monday, June 23. Stock futures (ES=F, NQ=F, YM=F) are relatively flat after the US bombed key Iranian nuclear sites. Federal Reserve Chair Jerome Powell hears to Capitol Hill this week to testify before House and Senate committees. Tesla's (TSLA) robotaxis made their debut in Austin, Texas over the weekend. To watch more expert insights and analysis on the latest market action, check out more Morning Brief here.",Yahoo,0.1245,"['Tesla', 'Federal Reserve', 'Capitol Hill', 'House', 'Senate', 'Tesla', 'TSLA']"
2025-06-23,Tesla Launches Robotaxi in Austin: Are Industry Dynamics Favorable?,"TSLA kicks off its first paid robotaxi rides in Austin, testing autonomous tech as rivals race to scale nationwide.",Yahoo,0.33,"['Tesla', 'TSLA']"
2025-06-23,"Tesla robotaxis, Apple AI, int'l airlines: Trending Tickers","Tesla (TSLA) launched a small fleet of robotaxis in Austin, Texas, charging $4.20 per ride. According to Bloomberg, Apple (AAPL) might be exploring a deal to acquire Perplexity AI, valued at $14 billion, to boost its artificial intelligence (AI) search engine ambitions. International airline stocks Air France (AF.PA), Lufthansa (LHA.DE), and International Consolidated (IAG.L) are under pressure, suspending some Arabian Gulf flights as the tensions between Iran and Israel escalate.  To watch more expert insights and analysis on the latest market action, check out more Morning Brief here.",Yahoo,0.0623,"['Tesla', 'Apple', 'Tesla', 'TSLA', 'Bloomberg', 'Apple', 'AAPL', 'Perplexity AI', 'Air France', 'AF.PA', 'Lufthansa', 'LHA.DE', 'International Consolidated', 'IAG.L']"
2025-06-23,How successful was Tesla's robotaxi launch?,"Tesla (TSLA) stock is trading higher after the electric vehicle (EV) pioneer's robotaxi launch event in Austin on Sunday. Yahoo Finance Executive Editor Brian Sozzi and Yahoo Finance anchor Julie Hyman chat with Washington Crossing Advisors senior portfolio manager Chad Morganlander and Innovator ETFs chief investment strategist Tim Urbanowicz about the event and what it means for Tesla investors. To watch more expert insights and analysis on the latest market action, check out more Opening Bid here.",Yahoo,0.1107,"['Tesla', 'Tesla', 'TSLA', 'Yahoo Finance', 'Yahoo Finance', 'Washington Crossing Advisors', 'Innovator ETFs', 'Tesla']"
2025-06-23,"Tesla, Inc. (TSLA): A Bear Case Theory","We came across a bearish thesis on Tesla, Inc. on High Growth Investing’s Substack by Stefan Waldhauser. In this article, we will summarize the bears’ thesis on TSLA. Tesla, Inc.’s share was trading at $322.16 as of June 20th. TSLA’s trailing and forward P/E were 184.09 and 166.67, respectively, according to Yahoo Finance. Tesla’s Q1 2025 earnings […]",Yahoo,0.7018,"['Tesla, Inc.', 'TSLA', 'Tesla, Inc.', 'TSLA', 'Tesla, Inc.’s', 'TSLA', 'Yahoo Finance', 'Tesla']"
2025-06-23,Why Is Tesla (TSLA) Stock Rocketing Higher Today,"Shares of electric vehicle pioneer Tesla (NASDAQ:TSLA) jumped 7.6% in the morning session after the company launched its highly anticipated robotaxi service in Austin, Texas, impressing Wall Street.",Yahoo,0.5,"['Tesla', 'TSLA', 'Tesla', 'TSLA']"
2025-06-23,"Tesla Whiplash: Musk’s Trump Tirade Tanked Stock, Recovery Hinted at Damage Control","On Thursday, June 5, Tesla (NASDAQ:TSLA) stock took a nosedive, dropping 14% and erasing over $150 billion in market value. The sharp decline was triggered by a public spat between TSLA CEO Elon Musk and President Trump. Musk publicly criticized the President’s proposed tax and spending legislation, cheekily called the “One Big Beautiful Bill Act.” […]",Yahoo,0.3976,"['Tesla', 'Tesla', 'TSLA', 'TSLA']"
2025-06-23,"Tesla still climbing, new Stellantis CEO: Trending Tickers","Tesla (TSLA) stock continues gaining after launching its robotaxi service in Austin, Texas over the weekend, with each ride costing $4.20. Antonio Filosa is stepping up as Stellantis's (STLA) new CEO. Filosa is coming in at a challenging time for the automaker. To watch more expert insights and analysis on the latest market action, check out more Market Domination here.",Yahoo,0.1241,"['Tesla', 'Stellantis', 'Tesla', 'TSLA', 'Stellantis', 'STLA']"
2025-06-23,Tesla's robotaxi: Analyst's two highlights from the launch,"Tesla (TSLA) finally launched its highly anticipated robotaxi in Austin, Texas, over the weekend. TD Cowen equity analyst Itay Michaeli says there were two aspects to the launch that went better than expected. Find out what they are in the video above. To watch more expert insights and analysis on the latest market action, check out more Market Domination Overtime here.",Yahoo,0.1988,"['Tesla', 'Tesla', 'TSLA', 'TD Cowen']"
2025-06-23,"Tesla’s (TSLA) AI Future Could Add $1 Trillion in Value, Says Dan Ives","Tesla, Inc. (NASDAQ:TSLA) is one of the 10 AI Stocks in the Spotlight. On June 20, Wedbush’s Dan Ives reiterated his “Outperform” rating on the stock with a $500 price target. According to Ives, Tesla “remains the most undervalued AI play in the market today,” having the potential to roughly double its value by the end of next […]",Yahoo,0.4448,"['Tesla', 'TSLA', 'Tesla, Inc.', 'NASDAQ', 'TSLA', 'Wedbush', 'Tesla']"
2025-06-25,Tesla's Trillion-Dollar Dream Faces A Cash Crunch,"Tesla's valuation relies on moonshot ambitions like autonomy and robotics, but lacks the capital and margins to outpace rivals. See why TSLA stock is a Sell.",SeekingAlpha,0.2481,"['Tesla', 'Tesla', 'TSLA']"
2025-06-25,Tesla (TSLA) Just Took a Major Step Toward Driverless Rides—But Is Wall Street Convinced?,"Tesla, Inc. (NASDAQ:TSLA) is one of the 10 Trending AI Stocks on Wall Street Right Now. On June 23, Barclays analyst Dan Levy reiterated an “Equal Weight” rating on the stock with a $275.00 price target. The firm quoted Tesla’s robotaxi service debut held in Austin to be “rather uneventful with no major issues.” “Tesla’s Robotaxi launch in […]",Yahoo,0.4448,"['Tesla', 'TSLA', 'Tesla, Inc.', 'TSLA', 'Barclays', 'Tesla', 'Tesla']"
2025-06-25,"Tesla Enters Indian Market With Showroom Openings, Model Y Launch in July","Tesla Inc. (NASDAQ:TSLA) is one of the best Fortune 500 stocks to buy according to billionaires. On June 20, Tesla announced that the company is set to enter the Indian automobile market, with its first showrooms expected to open in July this year. The initial launch will see showrooms in Mumbai, anticipated by mid-July, followed […]",Yahoo,0.1988,"['Tesla', 'Tesla Inc.', 'TSLA', 'Tesla']"
2025-06-25,Better EV Stock: Rivian vs. Tesla,"With Tesla's vehicle sales sliding, shareholders are pinning their hopes on its robotaxi business.  Rivian is looking to launch a cheaper SUV to appeal to a more mainstream audience.  Tesla (NASDAQ: TSLA) has long been the leader in the electric vehicle (EV) market, but several upstarts have also entered the picture in recent years.",Yahoo,0.1241,"['Rivian', 'Tesla', 'Tesla', 'Rivian', 'Tesla', 'TSLA']"
2025-06-25,"Stocks to Watch Wednesday: FedEx, QuantumScape, Tesla","? Tesla (TSLA): The EV maker logged another month of steep sales declines in the European Union. Tesla's new-car registrations fell more than 40% in May, data from a European industry body showed. ↘️ FedEx (FDX): The delivery company said it expects a $170 million headwind this quarter from a change in tariff rules that sliced demand for packages shipped to the U.",Yahoo,0.0902,"['FedEx', 'QuantumScape', 'Tesla', 'Tesla', 'TSLA', 'Tesla', 'FedEx', 'FDX']"
2025-06-25,Tesla: The Party Is Coming To An End,"Tesla, Inc. faces challenging times as underperformance lingers. Musk's political ties hurt the brand, and overvaluation makes it a Sell. Click for my TSLA update.",SeekingAlpha,0.4962,"['Tesla', 'Tesla, Inc.', 'TSLA']"
2025-06-25,Tesla: Robotaxis' Dream Versus Harsh Reality,"Tesla, Inc.'s $1T valuation is unsustainable amid declining profits, weak margins, and AI overhype. Click for my updated look at TSLA and its robotaxi plans.",SeekingAlpha,0.2481,"['Tesla', ""Tesla, Inc.'s"", 'TSLA']"
2025-06-25,NHTSA Investigates Tesla Robotaxis After Reported Traffic Violations in Austin Launch,"Tesla Inc. (NASDAQ:TSLA) is one of the best US tech stocks to buy now. On June 24, Bloomberg reported that the US National Highway Traffic Safety Administration/NHTSA is investigating incidents involving Tesla’s self-driving robotaxis, which reportedly violated traffic laws during their first day of paid operations in Austin, Texas. The agency confirmed on June 23 […]",Yahoo,0.1104,"['NHTSA', 'Tesla', 'Tesla Inc.', 'TSLA', 'Bloomberg', 'the US National Highway Traffic Safety Administration/NHTSA', 'Tesla']"
2025-06-25,Tesla’s Robotaxis Reportedly Sped and Veered Into the Wrong Lanes. Does This Crush the Bull Case for TSLA Stock?,"Tesla stock surged over 8% after its robotaxi initiative launched in Austin, Texas. However, it now faces a few regulatory concerns.",Yahoo,0.4012,"['Tesla', 'TSLA', 'Tesla']"
2025-06-25,What's next for Tesla as its European demand evaporates,"Tesla (TSLA) stock slides after data showed that the company's European sales dropped nearly 28% in May, even as overall electric vehicle (EV) demand in the region rose. Yahoo Finance Senior Reporter Pras Subramanian joins Asking for a Trend host Josh Lipton and Fundstrat Global Advisors managing director and global head of technical strategy Mark Newton to discuss what's behind Tesla's slump and how the stock might move going forward. To watch more expert insights and analysis on the latest market action, check out more Asking for a Trend here.",Yahoo,0.1422,"['Tesla', 'Tesla', 'TSLA', 'Yahoo Finance', 'Fundstrat Global Advisors', 'Tesla']"
2025-06-26,"Tesla exec. & Musk confidant reportedly ousted, US stocks rise","John Hyland outlines some of the top stories on the trading day on this rendition of Yahoo Finance's Market Minute. Micron (MU) shares fall despite reporting earnings results that beat estimates. Tesla (TSLA) executive Omead Afshar has left the company, according to Bloomberg, with Forbes reporting Afshar was fired. Novo Nordisk (NVO) announces a weight loss drug partnership with Weight Watchers, just after the pharma giant cut ties with Hims & Hers (HIMS). Stay up to date on the latest market action, minute-by-minute, with Yahoo Finance's Market Minute",Yahoo,0.0665,"['Tesla', ""Yahoo Finance's"", 'Micron', 'MU', 'Tesla', 'TSLA', 'Bloomberg', 'Forbes', 'Novo Nordisk', 'NVO', 'Weight Watchers', 'Hims & Hers', 'HIMS', ""Yahoo Finance's""]"
2025-06-27,"Pomerantz Law Firm Investigates Claims On Behalf of Investors of Tesla, Inc. - TSLA","NEW YORK, June 27, 2025 /PRNewswire/ -- Pomerantz LLP is investigating claims on behalf of investors of Tesla, Inc.  . Such investors are advised to contact Danielle Peyton at...",Finnhub,0.6255,"['Pomerantz Law Firm', 'Tesla, Inc.', 'TSLA', 'Pomerantz LLP', 'Tesla, Inc.']"
2025-06-27,Tesla Q2 delivery update: What to expect,"Tesla (TSLA) will report its most recent delivery numbers on Wednesday, July 2. Yahoo Finance Autos Reporter Pras Subramanian outlines what to expect from the electric vehicle (EV) pioneer's sales report. To watch more expert insights and analysis on the latest market action, check out more Market Catalysts here.",Yahoo,0.1988,"['Tesla', 'Tesla', 'TSLA', 'Yahoo Finance']"
2025-06-27,Who is Omead Afshar? How his reported exit impacts Tesla & Musk,"Tesla (TSLA) CEO Elon Musk has reportedly fired Omead Afshar, Tesla's head of manufacturing and operations, according to Forbes. Yahoo Finance Autos Reporter Pras Subramanian explains what the Tesla executive's departure means for the company and CEO Elon Musk. To watch more expert insights and analysis on the latest market action, check out more Market Catalysts here.",Yahoo,0.1245,"['Tesla', 'Tesla', 'TSLA', 'Tesla', 'Forbes', 'Yahoo Finance', 'Tesla']"
2025-06-27,"Tesla, Inc. (TSLA): It’s Okay For Robotaxis To Make Mistakes, Says Jim Cramer","Tesla, Inc. (NASDAQ:TSLA) is one of the Jim Cramer Says Trump’s Angry At Everybody & Discusses These 11 Stocks. Tesla, Inc. (NASDAQ:TSLA) is another feature of Cramer’s morning show. Despite tumultuous share price performance in 2025, Cramer continued to assert before the firm’s recent share price gains that the stock had a lot of potential […]",Yahoo,1.0,"['Tesla, Inc.', 'Tesla, Inc.', 'TSLA', 'Tesla, Inc.', 'TSLA']"
