date,headline,summary,source,relevance,entities
2024-12-05,"Tesla stock rises, Lululemon & HPE earnings in focus: Yahoo Finance","Shares of Tesla (TSLA) are on the rise after Bank of America analyst John Murphy raised his price target on the stock from $350 to $400. Murphy boosted his price target after visiting the automaker’s Gigafactory in Austin, writing that the company is “well-positioned to grow in 2025+.” Other companies in focus this afternoon are Lululemon (LULU) and HPE (HPE), which will release their quarterly earnings reports later today. Other Yahoo Finance trending tickers include SoundHound AI (SOUN), Uber (UBER), and MicroStrategy (MSTR). Key guests include:3:05 p.m. ET - Michael Saylor, MicroStrategy Executive Chairman3:20 p.m. ET - Eric Freedman, U.S. Bank Asset Management Group Chief Investment Officer3:30 p.m. ET - Sassine Ghazi, Synopsys CEO3:45 p.m. ET - Anthony Scaramucci, SkyBridge Founder4:20 p.m. ET - David Swartz, Morningstar Equity Analyst",Yahoo,0.0369,"['Tesla', 'Lululemon', 'HPE', 'Yahoo Finance', 'Tesla', 'TSLA', 'Bank of America', 'Lululemon', 'LULU', 'HPE', 'HPE', 'Yahoo Finance', 'SoundHound AI', 'SOUN', 'Uber', 'UBER', 'MicroStrategy', 'MSTR', 'MicroStrategy', 'U.S. Bank Asset Management Group', 'Synopsys', 'SkyBridge', 'Morningstar']"
2024-12-05,"Jim Cramer on Tesla, Inc. (TSLA) CEO Elon Musk: ‘He May Be The Most Important Man In America For All I Know, As Long As He Stays Tight With Trump’","We recently published an article titled Jim Cramer Discussed 10 Stocks That Can Do Well in December.In this article, we are going to take a look at where Tesla, Inc. (NASDAQ:TSLA) stands against the other stocks that can do well in December according to Jim Cramer. Jim Cramer, the host of Mad Money, recently shared […]",Yahoo,1.0,"['Tesla, Inc.', 'TSLA', 'Tesla, Inc.', 'TSLA']"
2024-12-05,Tesla stock gets price target bump to $400 by BofA analysts,"After Bank of America Securities analysts reiterated their Buy rating after a visit to the EV maker's gigafactory in Austin, Tesla (TSLA) shares are rising by over 3%. The team, led by analyst John Murphy, also raised its price target on Tesla to $400 per share. Julie Hyman and Josh Lipton report more on the analyst commentary. To watch more expert insights and analysis on the latest market action, check out more Market Domination here. This post was written by Luke Carberry Mogan.",Yahoo,0.1241,"['Tesla', 'BofA', 'Bank of America Securities', 'Tesla', 'TSLA', 'Tesla']"
2024-12-06,"Tesla, Inc. (TSLA) Gains Price Target Boost from Bank of America Amid AI and Robotics Advances","We recently compiled a list of the 10 AI News Investors Should Not Miss. In this article, we are going to take a look at where Tesla, Inc. (NASDAQ:TSLA) stands against the other AI stocks investors should not miss. During an appearance on CNBC’s Squawk Box Europe, Matt Calkins, CEO of Appian, discussed the outlook for the […]",Yahoo,0.5464,"['Tesla, Inc.', 'TSLA', 'Bank of America', 'Tesla, Inc.', 'NASDAQ', 'TSLA', 'CNBC', 'Appian']"
2024-12-06,Why Elon Musk and Trump could fall flat with DOGE,"Investors have largely ignored geopolitical risks in 2024, opting instead to latch onto bull stories such as AI, robust corporate earnings growth and Fed rate cuts. But the overlooking of key risks may not come into 2025 as President-elect Trump promotes an America first economic agenda. Yahoo Finance Executive Editor Brian Sozzi chats with geopolitical strategist and New York Times best-selling author Peter Zeihan. Zeihan breaks down some of the top geopolitical risks for investors to know ahead of 2025 – one of them being Tesla (TSLA) CEO Elon Musk. How much risk will returning president Trump bring to tense geopolitical situations such as the Ukraine/Russia war? Will penalizing tariffs on China unleash new problems for the global economy? This latest episode dives into all of these topics and much more. For full episodes of Opening Bid, listen on your favorite podcast platform or watch on our website.",Yahoo,0.2,"['Fed', 'Yahoo Finance', 'New York Times', 'Tesla', 'TSLA']"
2024-12-06,"Gary Black Says Tesla's Bitcoin Holdings Not 'Relevant' To TSLA's Stock Price, Urges Focus On EV Expansion And Share Buybacks","Future Fund LLC Managing Partner Gary Black criticized Tesla Inc.‘s (NASDAQ:TSLA) Bitcoin (CRYPTO: BTC) holdings Wednesday, arguing they have minimal impact on the electric vehicle maker’s stock value as the cryptocurrency reached record highs. What ...",Yahoo,0.4292,"['Tesla', 'TSLA', 'Future Fund LLC', 'Tesla Inc.‘s', 'TSLA']"
2024-12-07,"Bernstein Analyst Assigns Sell Rating on Tesla, Inc. (TSLA), Citing Risks in Robotaxi Project and Overvaluation","We recently compiled a list of the 15 AI News Updates That Broke The Internet. In this article, we are going to take a look at where Tesla, Inc. (NASDAQ:TSLA) stands against the other AI stocks that broke the Internet recently. With Trump taking in the reigns soon, steps toward overhauling the US policy have begun. […]",Yahoo,0.6667,"['Bernstein', 'Tesla, Inc.', 'TSLA', 'Tesla, Inc.', 'NASDAQ', 'TSLA']"
2024-12-07,"What Is Tesla, Inc. (TSLA) The Best Lithium and Battery Stocks to Buy Now?","We recently compiled a list of the 11 Best Lithium and Battery Stocks To Invest In. In this article, we are going to take a look at where Tesla, Inc. (NASDAQ:TSLA) stands against the other lithium and battery stocks. The West Auto Industry Faces Uncertainty with Potential Tariffs and Policy Reversals According to a Reuters report […]",Yahoo,0.7519,"['Tesla, Inc.', 'TSLA', 'Tesla, Inc.', 'NASDAQ', 'TSLA', 'Reuters']"
2024-12-08,Tesla Stock vs. Amazon Stock: Billionaires Buy One and Sell the Other Ahead of 2025,"Tesla (NASDAQ: TSLA) and Amazon (NASDAQ: AMZN) are included in that number, with shares advancing 57% and 49%, respectively.  Louis Bacon of Moore Capital Management bought 25,000 shares of Tesla, increasing his position by 19%.  Meanwhile, he sold 616,475 shares of Amazon, reducing his stake by 76%.",Yahoo,0.0904,"['Tesla', 'Amazon', 'Tesla', 'TSLA', 'Amazon', 'AMZN', 'Moore Capital Management', 'Tesla', 'Amazon']"
2024-12-09,Deutsche Bank names Tesla stock 'a key idea for 2025',"Investing.com -- Deutsche Bank highlighted Tesla (NASDAQ:TSLA) as one of its top picks for 2025 in a note Monday, citing its leadership in autonomous driving technology and its ability to withstand industry headwinds.",Yahoo,0.1416,"['Deutsche Bank', 'Tesla', 'Deutsche Bank', 'Tesla', 'TSLA']"
2024-12-09,"TSLA, BLNK & Other EV Charging Stocks to Watch in 2025","As EV adoption surges, demand for charging infrastructure rises. Watch TSLA, RIVN, BLNK, and CHPT for long-term potential in the EV charging space.",Yahoo,0.3759,"['TSLA', 'BLNK', 'TSLA', 'RIVN', 'BLNK', 'CHPT']"
2024-12-09,Mag 7's profit growth forecasted to slow in 2025: Bloomberg,"As the S&P 500's (^GSPC) Magnificent Seven — Meta Platforms (META) Microsoft (MSFT) Alphabet (GOOGL, GOOG), Amazon (AMZN), Apple (AAPL), Nvidia (NVDA), Tesla (TSLA) — could see its profit growth slow from 34% to 18% in 2025, Bloomberg Intelligence reports the healthcare sector could take the lead. Yahoo Finance host Madison Mills joins the Morning Brief to break down Bloomberg Intelligence's latest earnings growth estimates. To watch more expert insights and analysis on the latest market action, check out more Morning Brief here. This post was written by Luke Carberry Mogan.",Yahoo,0.0476,"['Bloomberg', 'Meta Platforms', 'META', 'Microsoft', 'MSFT', 'Alphabet', 'GOOGL', 'GOOG', 'Amazon', 'AMZN', 'Apple', 'AAPL', 'Nvidia', 'NVDA', 'Tesla', 'TSLA', 'Bloomberg Intelligence', 'Yahoo Finance', 'the Morning Brief', ""Bloomberg Intelligence's""]"
2024-12-09,"Tesla, Reddit, eBay: Top analyst calls","Seana Smith and Brad Smith examine the top analyst calls on Morning Brief. Tesla (TSLA) stock is on the rise after Bank of America analysts boosted their price target to $400 from $350 following a visit to the company's Texas gigafactory. Morgan Stanley analysts upgrade its rating of Reddit (RDDT) and lift its price target to a Street high of nearly triple its previous estimate, saying they were wrong to wait on the sidelines. Wedbush rates eBay (EBAY) Neutral, saying there are few near-term positive catalysts. To watch more expert insights and analysis on the latest market action, check out more Morning Brief here. This post was written by Naomi Buchanan.",Yahoo,0.0621,"['Tesla', 'Reddit', 'eBay', 'Morning Brief', 'Tesla', 'TSLA', 'Bank of America', 'Morgan Stanley', 'Reddit', 'RDDT', 'Wedbush', 'eBay', 'EBAY']"
2024-12-09,The next milestone for Bitcoin could be $250K: YouTuber Matt Kohrs,"Now that bitcoin (BTC-USD) breached the crucial psychological $100K mark, what's next for the cryptocurrency? One investor is confident that it will continue to rise in the coming calendar year. Matt Kohrs, YouTuber and ""The Matt Kohrs Show"" host, tells Wealth! host Brad Smith that he sees two paths ahead for bitcoin: ""It's either the best store of value ever created, or we're looking at another tulip mania that is maybe on the precipice of popping."" Kohrs is positive on bitcoin, citing its performance against the U.S. dollar. ""Now, in the short term, your guess is as good as mine. We might as well just be flipping a coin. But in the long term, if this idea of a store of value and the US dollar always being devalued, I think bitcoin goes higher and higher."" When it comes to the next major milestone for bitcoin, Kohrs says, ""I think the next big psychological level in terms of US dollar value will be 250,000, which I want to make clear, I do believe is very possible in the upcoming calendar year."" He's less positive when analyzing the fundamentals of GameStop (GME) and other so-called ""meme stocks."" Kohrs says, ""When I look at the entire investable universe, GameStop's not really a top tier one because we don't have much forward direction from the company and the company's leadership at this moment in time."" Instead, he suggests these retail investors have more to gain from companies with stronger fundamentals, including Tesla (TSLA) and Palantir (PLTR). For more expert insight and the latest market action, click here to watch this full episode of Wealth. This post was written by Kayla Hawkins.",Yahoo,0.1,"['Wealth!', 'Kohrs', 'GameStop', 'GME', 'GameStop', 'Tesla', 'TSLA', 'Palantir', 'PLTR', 'Wealth']"
2024-12-09,Mag 7 'not critical' for market success in 2025: Strategist,"While Bloomberg Intelligence is forecasting the Magnificent Seven's earnings growth — Meta Platforms (META), Microsoft (MSFT), Alphabet (GOOGL, GOOG), Amazon (AMZN), Apple (AAPL), Nvidia (NVDA), Tesla (TSLA) — to drop from 2024's 34% to 18% in 2025, will the group of tech stocks be as pivotal for the S&P 500 (^GSPC) in the new year? ""They're obviously important for the market, but they're not critical for the market's success. And we see signs that earnings growth is set to broaden out as we head into 2025,"" J.P. Morgan Private Bank US Head of Investment Strategy Jake Manoukian tells Seana Smith and Brad Smith on the Morning Brief. To watch more expert insights and analysis on the latest market action, check out more Morning Brief here. ]This post was written by Luke Carberry Mogan.",Yahoo,0.0588,"['Bloomberg Intelligence', 'Meta Platforms', 'META', 'Microsoft', 'MSFT', 'Alphabet', 'GOOGL', 'GOOG', 'Amazon', 'AMZN', 'Apple', 'AAPL', 'Nvidia', 'NVDA', 'Tesla', 'TSLA', 'J.P. Morgan Private Bank']"
2024-12-09,Why Tesla (TSLA) Is Among the Best Autonomous Driving Stocks to Buy According to Hedge Funds,"We recently compiled a list of the 10 Best Autonomous Driving Stocks To Buy According to Hedge Funds. In this article, we are going to take a look at where Tesla, Inc. (NASDAQ:TSLA) stands against the other best autonomous driving stocks to buy. The vision of fleets of driverless cars seamlessly transporting passengers has captivated […]",Yahoo,0.665,"['Tesla', 'TSLA', 'Tesla, Inc.', 'TSLA']"
2024-12-09,Tesla (TSLA) Gains As Market Dips: What You Should Know,"Tesla (TSLA) concluded the recent trading session at $389.79, signifying a +0.15% move from its prior day's close.",Yahoo,0.5,"['Tesla', 'TSLA', 'Tesla', 'TSLA']"
2024-12-10,Gary Black Boosts Tesla Price Target By 27% To $380 Based On 'Increased Conviction' That Elon Musk-Led Company Will Launch $25K Hatchback,"Tesla Inc. (NASDAQ:TSLA) could see significant growth from a new budget electric vehicle offering, according to prominent investor Gary Black, who raised his price target for the EV maker by 27% to $380 from $300 on Monday. What Happened: Black, Managing Partner at The Future Fund LLC, attributes his “increased conviction” to expectations that Tesla will launch a $25,000-$30,000 hatchback model, potentially capturing approximately 15% of the global compact car market. Don’t Miss: Warren Buffett",Yahoo,0.1422,"['Tesla', 'Tesla Inc.', 'NASDAQ', 'TSLA', 'The Future Fund LLC', 'Tesla']"
2024-12-10,How to play the Mag 7 stocks in 2025: Portfolio manager,"The ""Magnificent Seven"" — made up of Nvidia (NVDA), Alphabet (GOOG, GOOGL), Tesla (TSLA), Microsoft (MSFT), Amazon (AMZN), Meta Platforms (META), and Apple (AAPL) — drove major indexes (^DJI, ^IXIC, ^GSPC) higher in 2024. Niles Investment Management founder and portfolio manager Dan Niles joins Market Domination Co-Hosts Julie Hyman and Josh Lipton to discuss how to play the megacap tech group in the new year. ""I think next year you're going to continue to see the broadening pattern,"" Niles says, adding that the policies associated with the incoming Trump administration, like lower taxes and deregulation, should support gains widening beyond the Magnificent Seven names. Watch the video above for Niles' outlook for Nvidia, Microsoft, and the other Magnificent Seven stocks. To watch more expert insights and analysis on the latest market action, check out more Market Domination here. This post was written by Naomi Buchanan.",Yahoo,0.05,"['Nvidia', 'NVDA', 'Alphabet', 'GOOG', 'GOOGL', 'Tesla', 'TSLA', 'Microsoft', 'MSFT', 'Amazon', 'AMZN', 'Meta Platforms', 'META', 'Apple', 'AAPL', 'Niles Investment Management', 'Market Domination', 'Nvidia', 'Microsoft', 'Market Domination']"
2024-12-10,BofA Says Tesla (TSLA) Positioned for Growth in 2025 and Beyond Following Gigafactory Visit,"We recently published a list of 10 Buzzing AI Stocks This Week. In this article, we are going to take a look at where Tesla Inc (NASDAQ:TSLA) stands against other buzzing AI stocks this Week. Paul Hickey, Bespoke Investment Group co-founder, said while talking to CNBC in a latest program that despite the market gains still […]",Yahoo,0.2732,"['BofA', 'Tesla', 'TSLA', 'Tesla Inc', 'NASDAQ', 'TSLA', 'Bespoke Investment Group', 'CNBC']"
2024-12-10,Why Tesla Stock Is on the Heels of a Record High Today,"Tesla (NASDAQ: TSLA) stock has been marching sharply higher since the U.S. presidential election last month, even with mixed expectations on how the incoming Trump administration will view electric vehicle (EV) companies.  Today, Tesla stock gained another 5% before paring back some of that jump.  Morgan Stanley analyst Adam Jonas has long been bullish on Tesla stock.",Yahoo,0.1422,"['Tesla', 'Tesla', 'TSLA', 'Tesla', 'Morgan Stanley', 'Tesla']"
2024-12-10,Tesla gets price target lift from Morgan Stanley,"Tesla (TSLA) shares are trading higher after Morgan Stanley raised its price target to $400 from $310, maintaining an Overweight rating. The firm also reaffirmed its top-pick status for the electric vehicle manufacturer. Analyst Adam Jonas suggests that the potential Trump-era backlash against electric vehicles will be short-lived, as the United States aims to maintain its leadership in autonomous driving technology. Market Domination Hosts Julie Hyman and Josh Lipton break down the details. To watch more expert insights and analysis on the latest market action, check out more Market Domination here. This post was written by Angel Smith",Yahoo,0.1416,"['Tesla', 'Morgan Stanley', 'Tesla', 'TSLA', 'Morgan Stanley']"
2024-12-10,Tesla’s (TSLA) AI-Driven Success: Why Deutsche Bank Says It’s a Top 2025 Pick,"We recently compiled a list of the 10 AI News That Broke The Internet. In this article, we are going to take a look at where Tesla, Inc. (NASDAQ:TSLA) stands against the other AI stocks. Should original content contributors be paid every time large language models use their work? OpenAI CEO Sam Altman believes they should, […]",Yahoo,0.3994,"['Tesla', 'TSLA', 'Deutsche Bank', 'Tesla, Inc.', 'NASDAQ', 'TSLA', 'OpenAI']"
2024-12-11,Tesla: Declining Sales Growth And Potential Margin Compression,"Tesla's Q3 2024 revenue growth decelerated to 8% YoY, with automotive gross margins dropping. Read why I downgrade TSLA stock from sell to strong sell.",SeekingAlpha,0.2481,"['Tesla', 'Tesla', 'TSLA']"
2024-12-11,Tesla's Path To $424 By Year-End,"Teslaâs strong production and CEO ties fuel stock gains. Find out why TSLA stock could reach $424, with FSD tech pushing the stock to $480 by year-end.",SeekingAlpha,0.33,"['Tesla', 'TSLA']"
2024-12-11,Why Is Tesla (TSLA) the Best Self-Driving Technology Stock to Buy According to Hedge Funds?,"We recently published a list of 10 Best Self-Driving Technology Stocks To Buy According to Hedge Funds. In this article, we are going to take a look at where Tesla, Inc. (NASDAQ:TSLA) stands against other best self-driving technology stocks to buy according to hedge funds. The autonomous driving industry is, along with machine learning and […]",Yahoo,0.665,"['Tesla', 'TSLA', 'Tesla, Inc.', 'TSLA']"
2024-12-11,Tesla: A Golden Buying Opportunity,Tesla's stock has surged 77% due to strong fundamentals and the upcoming budget Model Q. Click here to find out why I think TSLA stock remains strong buy rated.,SeekingAlpha,0.2481,"['Tesla', 'Tesla', 'TSLA']"
2024-12-11,"Tesla, Inc.'s (NASDAQ:TSLA) Stock's On An Uptrend: Are Strong Financials Guiding The Market?",Tesla (NASDAQ:TSLA) has had a great run on the share market with its stock up by a significant 76% over the last three...,Yahoo,0.5,"[""Tesla, Inc.'s"", 'TSLA', 'Tesla', 'TSLA']"
2024-12-11,Tesla hits record high as post-election surge continues,"Investing.com -- Tesla Inc (NASDAQ:TSLA), hit a record high Wednesday as the EV maker continues its post-election surge on bets that CEO Elon Musk's close relationship with president-elect Donald Trump will benefit Tesla.",Yahoo,0.1988,"['Tesla', 'Tesla Inc', 'TSLA', 'Tesla']"
2024-12-11,How Long Can Tesla (TSLA) Keep Chinese EVs At Bay?,"With Chinese automakers entering the EV market and increasing regulatory pressures in Europe, tensions keep mounting for Tesla. Meanwhile, Waymo is racing ahead of Tesla in autonomous driving supremacy. Can Tesla bounce back from such mounting setbacks, or has it lost its edge? The stock price reflects a lot of optimism but are investors realizing […]",Yahoo,0.2519,"['Tesla', 'TSLA', 'Tesla', 'Waymo', 'Tesla', 'Tesla']"
2024-12-11,Mag 7 will 'power through' markets in 2025: Strategist,"Roundhill Investments CEO David Mazza joins Market Domination Overtime to discuss why the Magnificent Seven stocks — Meta Platforms (META), Microsoft (MSFT), Alphabet (GOOGL, GOOG), Amazon (AMZN), Apple (AAPL), Nvidia (NVDA), Tesla (TSLA) — are positioned to outperform in markets in 2025. ""People don't want to be on the wrong side of what has been, for two years, an incredibly impressive trade,"" he tells Yahoo Finance. Investors are returning to the Magnificent 7 names because these stocks provide both offensive and defensive strategies in the current market landscape. ""These companies as a whole... really have impressive operating leverage,"" Mazza notes. With uncertainty surrounding potential tariffs and inflation in the upcoming year, investors are seeking companies that can ""power through"" economic challenges, which increasingly points them toward the Magnificent Seven. Despite this focus, Mazza adds: ""I think there is a general sentiment that the economy is okay, and we have so much positive investor sentiment right now, and that to me is what's really pushing the market higher."" To watch more expert insights and analysis on the latest market action, check out more Market Domination Overtime here. This post was written by Angel Smith",Yahoo,0.0556,"['Roundhill Investments', 'Market Domination Overtime', 'Meta Platforms', 'META', 'Microsoft', 'MSFT', 'Alphabet', 'GOOGL', 'GOOG', 'Amazon', 'AMZN', 'Apple', 'AAPL', 'Nvidia', 'NVDA', 'Tesla', 'TSLA', 'Yahoo Finance']"
2024-12-12,Tesla Stock Hits All-Time High: ETFs to Ride the Momentum,Tesla shares hit an all-time high. Several analysts raised price targets. How can you play TSLA stock with lower level of risks? Tap Tesla-focused ETFs.,Yahoo,0.1988,"['Tesla', 'Tesla', 'TSLA', 'Tesla']"
2024-12-12,1 Wall Street Analyst Just Called Tesla a Top Pick. Is it a Buy Now?,"Tesla (NASDAQ: TSLA) stock has emerged as a big winner in 2024.  First, the stock soared after its Q3 earnings report release on Oct. 2, posting stronger profit growth than expected, as well as solid revenue growth.  Then, Tesla stock soared following the election of Donald Trump as U.S. president.",Yahoo,0.1658,"['Tesla', 'Tesla', 'NASDAQ', 'TSLA', 'Tesla']"
2024-12-12,TSLA Stock Breaks Records: Why It's a Must-Buy Going Into 2025,"With growth catalysts like AV advancements, a booming energy business and strong vehicle delivery forecasts, Tesla's 2025 outlook remains promising.",Yahoo,0.67,"['TSLA', 'Tesla']"
2024-12-12,The Build A Tesla Thesis: How Tesla Can Be Replicated And How Much It Costs,Tesla trades at an irrational valuation even considering every single business it is in versus better competitors in all of them. Learn more on TSLA stock here.,SeekingAlpha,0.165,"['Tesla', 'Tesla', 'Tesla', 'TSLA']"
2024-12-13,Tesla And Its Major Growth Catalysts -- $430 Near-Term Target,Tesla's dominance in the green transition and efficiency improvements set it up for long-term success. See why TSLA stock is a strong buy with a $430 target price.,SeekingAlpha,0.2481,"['Tesla', 'Tesla', 'TSLA']"
2024-12-13,Tesla: Valuation Has Reached Dangerously High Levels (Downgrade),"Tesla still needs to overcome several critical hurdles before it can even scale its robotaxi business, indicating significant execution risks. Click for this TSLA update.",SeekingAlpha,0.2481,"['Tesla', 'Tesla', 'TSLA']"
2024-12-13,Tesla: 4 Reasons I'm Selling In 2025 After Years Of Buying And Holding (Downgrade),"Tesla's $1.33 trillion market cap and 130x FY25 P/E ratio are unsustainable, especially compared to Rivian. See why I'm downgrading TSLA stock to a sell rating.",SeekingAlpha,0.1988,"['Tesla', 'Tesla', 'Rivian', 'TSLA']"
2024-12-13,Tesla’s (TSLA) $345 Price Target: Why Goldman Sachs is Betting on AI for the EV Giant?,"We recently compiled a list of the 10 AI News Investors Shouldn’t Miss. In this article, we are going to take a look at where Tesla, Inc. (NASDAQ:TSLA) stands against the other AI stocks. Angie Newman from UBS Private Wealth Management discussed how to take advantage of the ongoing artificial intelligence boom on CNBC’s Squawk […]",Yahoo,0.3994,"['Tesla', 'TSLA', 'Goldman Sachs', 'Tesla, Inc.', 'TSLA', 'UBS Private Wealth Management', 'CNBC']"
2024-12-13,Musk faces SEC settlement demand over X purchase,"Tesla (TSLA) CEO Elon Musk has revealed that the Securities and Exchange Commission (SEC) has issued him a settlement demand. The regulatory agency is investigating whether Musk committed securities fraud during his 2022 buyout of X (formerly Twitter). Yahoo Finance Senior Columnist Rick Newman breaks down the details, exploring how the upcoming administration might influence the trajectory of this ongoing investigation once Donald Trump takes office. To watch more expert insights and analysis on the latest market action, check out more Morning Brief here. This post was written by Angel Smith",Yahoo,0.0904,"['SEC', 'X', 'Tesla', 'TSLA', 'the Securities and Exchange Commission', 'SEC', 'X', 'Twitter', 'Yahoo Finance']"
2024-12-13,"Cathie Wood's Ark Invest Trims Tesla Exposure Amid Searing Rally, Sells $21.8M Worth Of Stock — Bets On This AI Medical Company","On Wednesday, Cathie Wood-led Ark Invest executed significant trades involving Tesla Inc. (NASDAQ:TSLA) and Tempus AI Inc. (NASDAQ:TEM). The investment firm opted to sell a substantial number of Tesla shares while increasing its stake in Tempus AI. ...",Yahoo,0.0904,"['Ark', 'Tesla', 'Ark Invest', 'Tesla Inc.', 'TSLA', 'Tempus AI Inc.', 'TEM', 'Tesla', 'Tempus AI']"
2024-12-13,"Tesla Stock: Big Potential, Bigger Risks, And Better Alternatives","Tesla, Inc.'s innovation and market opportunities are promising, but its high valuation and challenges pose significant for long-term investors. Learn more on TSLA stock here.",SeekingAlpha,0.2481,"['Tesla', ""Tesla, Inc.'s"", 'TSLA']"
2024-12-13,Tesla (TSLA) Named Top 2025 Pick by Morgan Stanley: AI and Renewable Energy Drive Investor Enthusiasm,"We recently published a list of Top 15 AI Stock News and Ratings Dominating Wall Street. In this article, we are going to take a look at where Tesla, Inc. (NASDAQ:TSLA) stands against other AI stock news and ratings dominating Wall Street. Is artificial intelligence hitting a wall? Speaking at the New York Times annual […]",Yahoo,0.4433,"['Tesla', 'TSLA', 'Morgan Stanley', 'Tesla, Inc.', 'TSLA', 'New York Times']"
