date,headline,summary,source,relevance,entities
2024-09-29,Tesla (TSLA) Poised for Major Robotaxi Event on October 10,Looking for stock market analysis and research with proves results? Zacks.com offers in-depth financial research with over 30years of proven results.,GuruFocus,0.4012,"['Tesla', 'TSLA', 'Zacks.com']"
2024-09-29,Tesla: Time To Cash Out Before Robotaxi Event (Rating Downgrade),"Tesla is getting ready for its robotaxi event in a few days, but the company faces an increase in headwinds. Read why TSLA stock is a Sell now.",SeekingAlpha,0.2481,"['Tesla', 'Tesla', 'TSLA']"
2024-09-30,Wells Fargo Reaffirms Their Sell Rating on Tesla (TSLA),Looking for stock market analysis and research with proves results? Zacks.com offers in-depth financial research with over 30years of proven results.,TipRanks,0.2863,"['Wells Fargo', 'Tesla', 'TSLA', 'Zacks.com']"
2024-09-30,Market Whales and Their Recent Bets on TSLA Options,Looking for stock market analysis and research with proves results? Zacks.com offers in-depth financial research with over 30years of proven results.,Benzinga,1.0,['TSLA']
2024-09-30,Tesla (TSLA) Rises Over 1.5% as Shanghai Factory Exports Reach New Milestone,Looking for stock market analysis and research with proves results? Zacks.com offers in-depth financial research with over 30years of proven results.,GuruFocus,0.4012,"['Tesla', 'TSLA', 'Zacks.com']"
2024-09-30,"Market Clubhouse Morning Memo - September 30th, 2024 (Trade Strategy For SPY, QQQ, AAPL, MSFT, NVDA, GOOGL, META And TSLA)",Looking for stock market analysis and research with proves results? Zacks.com offers in-depth financial research with over 30years of proven results.,Benzinga,0.125,"['SPY', 'QQQ', 'AAPL', 'MSFT', 'NVDA', 'GOOGL', 'META', 'TSLA']"
2024-09-30,Tesla Stock Is A Great Buy Before The October Event,Tesla's Dojo supercomputer and AI capabilities position it ahead of the competition. Read more on TSLA stock and how it leverages its technological edge.,SeekingAlpha,0.2481,"['Tesla', 'Tesla', 'TSLA']"
2024-10-02,Tesla's energy division on track to keep pace with autos demand,"Tesla (TSLA) stock is facing downward pressure after falling short of it's highly anticipated third-quarter delivery expectations. The company reported 462,890 deliveries, slightly below the Bloomberg estimate of 463,897. William Blair group head of energy and sustainability research sector Jed Dorsheimer joins Morning Brief to discuss his outlook on the automaker. Dorsheimer notes that the growing optimism in delivery estimates on Wall Street was closely tied to Tesla's rising stock price. Consequently, he says, ""it's not surprising to see a pullback"" now that the numbers have missed expectations. Despite this setback, Dorsheimer points out that this quarter demonstrates Tesla's stabilization ahead of ""some key catalysts"" for the business, including the upcoming robotaxi event and the Shanghai energy business. Importantly, Dorsheimer emphasizes the significance of Tesla's energy business and its potential impact on the company's future growth. He states, ""Our grids are stressed to the max right now and that's a global statement. And so looking at Megapack as a solution for a portion of that, that demand in our opinion could be as much as what we're seeing on the vehicle side."" For more expert insight and the latest market action, click here to watch this full episode of Morning Brief. This post was written by Angel Smith",Yahoo,0.0997,"['Tesla', 'Tesla', 'TSLA', 'Bloomberg', 'Morning Brief', 'Tesla', 'Tesla', 'Tesla', 'Megapack']"
2024-10-02,Why the Nasdaq is positioned for long-term growth,"Technical indicators from Oppenheimer suggest that big tech companies, especially names like Meta (META) and Tesla (TSLA), are poised to outperform in the coming months. Oppenheimer Head of Technical Analysis Ari Wald joins Catalysts to discuss this outlook. Wald emphasizes that the key positive for markets is that market breadth ""remains firm,"" supporting higher highs throughout the end of 2024. Based on this, he believes ""the bull cycle is intact,"" with the market positioned for continued growth into 2025. He advises buying higher growth companies, explaining, ""The scarcity premium comes back against a lower growth backdrop for these names,"" especially within the tech-heavy Nasdaq (^IXIC). Wald elaborates on the Nasdaq's potential: ""It has underperformed since the summer, but I think through this rotational nature it is set up to lead again. It did a good job holding up support levels and so for that reason, for us, it's growth for the long-term. I think this is a growth and tech-led secular bull, and then on a near-term basis, it's become tactically attractive to buy that style as well."" For more expert insight and the latest market action, click here to watch this full episode of Catalysts. This post was written by Angel Smith",Yahoo,0.0831,"['Nasdaq', 'Oppenheimer', 'Meta', 'META', 'Tesla', 'TSLA', 'Oppenheimer', 'Catalysts', 'Nasdaq', 'Nasdaq', 'Catalysts']"
2024-10-02,Why Tesla (TSLA) Stock Is Trading Lower Today,"Shares of electric vehicle pioneer Tesla (NASDAQ:TSLA) fell 6.1% in the morning session after the company reported Q3 2024 electric vehicle (EV) deliveries of 462,890, below analysts' estimates. The stock's reaction hints at potential concerns on the demand side of its EV business. Notably, growth has been slower than expected in recent quarters, with deliveries in the first six months of 2024 down roughly 7% year on year.",Yahoo,0.5,"['Tesla', 'TSLA', 'Tesla', 'TSLA']"
2024-10-02,"Tesla Q3 deliveries, private payrolls data: Morning Brief","On today's episode of Morning Brief, Hosts Seana Smith and Brad Smith analyze the market open and report on some of the biggest stories impacting markets. All three of the major indexes (^DJI,^GSPC, ^IXIC) opened slightly lower on Wednesday, while oil prices (CL=F, BZ=F) continued to rise and bitcoin (BTC-USD) experienced a sharp decline. Traders flocked to more defensive areas of the market in Tuesday's trading session after Iran launched a ballistic missile attack on Israel. Israel has vowed to respond to the attack, raising concerns about tensions in the Middle East escalating even further. Raymond James Washington policy analyst and managing director Ed Mills observes that markets have been ""shockingly resilient"" despite global unrest. ""There are a lot of unknowns ahead and Israel will absolutely respond. They cannot let hundreds of missiles going towards their country be met without a response,"" Mills states. However, he notes that the nature of Israel's response remains ""uncertain."" US private payroll numbers beat Wall Street expectations in September, according to the latest ADP report. The data shows that 143,000 jobs were added in the private sector last month, surpassing the projected 125,000 jobs — a significant increase from August's reported 99,000 jobs. Tesla (TSLA) shares are under pressure after the company reported that it delivered 462,890 vehicles during the third quarter. This figure came in slightly below Wall Street's expectation of 463,897 deliveries. William Blair group head of energy and sustainability research sector, Jed Dorsheimer, notes that the growing optimism in delivery estimates on Wall Street was closely tied to Tesla's rising stock price. Consequently, he says, ""it's not surprising to see a pullback"" now that the numbers have missed expectations. Despite this setback, Dorsheimer points out that this quarter demonstrates Tesla's stabilization ahead of ""some key catalysts"" for the business, including the upcoming robotaxi event and the Shanghai energy business. Nike (NKE) is looking for a fresh start under its incoming CEO, Elliott Hill. The footwear giant reported mixed fiscal first quarter results, withdrew its full-year sales guidance, and postponed its investor day that was originally scheduled for November. Hill will step into the role on October 14, where he will embark on a turnaround mission for the company. Baird Senior Research Analyst Jonathan Komp argues that under Hill, Nike will likely be able to improve its performance, saying, ""Generally, we expect stocks in the sector to bottom when earnings start getting less bad. We think we've seen the worst here for Nike, but it is going to take patience."" As the Federal Reserve's rate easing cycle is underway, Megan Horneman, Verdence Capital Advisors CIO, believes that investors are putting too much faith in a soft landing. She tells Yahoo Finance, ""People are just getting a little ahead of themselves as far as what strength there is in the economy."" While the labor market remains ""relatively strong,"" she has concerns about the consumer, noting that credit card debt is over $1 trillion. She adds, ""We know that inflation is coming down towards the Fed's target, but we can't forget that this has been accumulating for several years now. So this is really a strain on consumers... I just don't see the strength in the consumer that's going to be able to last much longer."" This post was written by Melanie Riehl",Yahoo,0.0555,"['Tesla', 'Raymond James', 'ADP', 'Tesla', 'TSLA', 'William Blair', 'Tesla', 'Tesla', 'Nike', 'NKE', 'Baird', 'Nike', 'Nike', ""the Federal Reserve's"", 'Verdence Capital Advisors', 'Yahoo Finance', 'Fed']"
2024-10-02,TSLA troubles: Tesla stock falls 4% after deliveries disappoint—but the robotaxi could be coming soon,"Elon Musk’s EV company delivered fewer cars in Q3 than Wall Street expected, but Tesla is planning an event to reveal the designs of its robotaxi later this month.",Yahoo,0.4012,"['TSLA', 'Tesla', 'Tesla']"
2024-10-02,September Brings New Records For Chinese EV Makers,"Five out of China’s six biggest EV makers posted record sales in September. Fueled by discounts and promotions, the Chinese EV pack led by BYD Company Limited (OTC: BYDDY) revived demand. While Li Auto Inc (NASDAQ: LI) and Xpeng Inc (NYSE: XPEV) also had a record sales month, Nio Inc (NYSE: NIO) was the only major Chinese carmaker that missed hitting record deliveries, but had sales grow by more than 35%. BYD continues to race to take over Tesla Inc (NASDAQ: TSLA). According to CnEVPost, BYD sol",Yahoo,0.0714,"['BYD Company Limited', 'BYDDY', 'Li Auto Inc', 'LI', 'Xpeng Inc', 'XPEV', 'Nio Inc', 'NYSE', 'NIO', 'BYD', 'Tesla Inc', 'TSLA', 'CnEVPost', 'BYD']"
2024-10-02,Tesla's Q3 deliveries don't matter in big picture: Analyst,"Tesla’s third quarter deliveries came in below Wall Street’s expectations, only adding to the mounting pressures facing the auto industry. Tom Narayan, RBC Capital Markets lead equity analyst of global autos, sits down with Market Domination Hosts Julie Hyman and Josh Lipton to dig into Tesla's (TSLA) delivery numbers and where the company stands going forward. Narayan outlines his view that Tesla’s subpar auto sales don’t actually matter, explaining that the “car business for me is less, like 5% of my [Tesla] valuation. They need to sell cars to sell [full self-driving] FSD and everything else. But I think folks are going to start looking at the bottom line more on gross profit. You're going to have regulatory credits, which surprised a lot of people last quarter. It's going to be good this quarter again and next year. And energy storage, people are finally talking about this. We saw the number that they printed today wasn't as good as last quarter, but way bigger than the run rate of last year. So I think folks are going to stop looking at the delivery numbers so carefully. And start looking at gross profit. And it's going to look pretty good.” He says the highly-anticipated robotaxi is “half of my entire valuation, as you know. I'm a big believer in the robotaxi concept. The difference, though, between this event and what they held in the Power Day a few years ago, where the stock was up quite a bit, is Power Day was more real now, whereas I think robotaxis are a little bit farther away. That's why I think it might be difficult to get crazy excited, at least a stock to react the way it will be. I think it did into it, but I do think you'll get a lot of people like me writing big reports finally with real numbers and putting it in their models. That might help. But again, this is far into the future, so I just don't know how much it's going to impact.” The long horizon for Tesla’s robotaxi isn’t a tech issue but rather a regulatory issue. “We all saw what happened with GM Cruise having to pull away and now starting to tip their toe back in. Cities are going to have to completely re-engineer themselves… It's a very human-driven thing, let's put it that way. You're making decisions all the time. And so it's going to take a while for regulators to be okay with that.” The analyst offers his perspective on the Cybertruck and the model's role in the Tesla brand. “I don't think it's a real game-changer. If anything, they're losing money on it, but it is trying to get excitement back into the brand, which maybe they lost a little compared to where they were. But really, ultimately, this is a halo car that hopefully lifts their brand.” For more expert insight and the latest market action, click here to watch this full episode of Market Domination. This post was written by Naomi Buchanan.",Yahoo,0.0831,"['Tesla', 'Tesla', 'RBC Capital Markets', 'Tesla', 'TSLA', 'Tesla', 'Tesla', 'Tesla', 'GM Cruise', 'Tesla', 'Market Domination']"
2024-10-02,What Tesla's upcoming robotaxi event means for investors,"Tesla (TSLA) shares are falling after the company reported third-quarter delivery numbers that fell slightly short of Wall Street expectations. The electric vehicle maker's next big test is now its highly anticipated robotaxi event scheduled for October 10th. Yahoo Finance reporter Akiko Fujita breaks down what investors can expect from this upcoming event and also explores the activities of competitors in the autonomous vehicle space. For more expert insight and the latest market action, click here to watch this full episode of Market Domination Overtime. This post was written by Angel Smith",Yahoo,0.1988,"['Tesla', 'Tesla', 'TSLA', 'Yahoo Finance']"
2024-10-02,"Tesla unlikely to grow sales, Robotaxi success faces rocky road; Bernstein says","Investing.com -- Tesla Inc (NASDAQ:TSLA) is unlikely to grow annual sales this year even with price cuts, Bernstein says, warning of a rocky road ahead for the EV maker that is unlikely to be rescued by the launch of robotaxis.",Yahoo,0.1416,"['Tesla', 'Bernstein', 'Tesla Inc', 'TSLA', 'Bernstein']"
2024-10-03,Tesla's Energy Storage Segment Hits New Milestone: Installs 750K Powerwalls Worldwide,"EV giant Tesla Inc. (NASDAQ:TSLA) said on Tuesday that it has installed 750,000 powerwalls worldwide, marking an important milestone for the company’s energy storage segment. What Happened: Tesla made the announcement on one of its several official X ...",Yahoo,0.1988,"['Tesla', 'Tesla Inc.', 'TSLA', 'Tesla']"
2024-10-03,Tesla (TSLA) Receives a Sell from J.P. Morgan,Looking for stock market analysis and research with proves results? Zacks.com offers in-depth financial research with over 30years of proven results.,TipRanks,0.2863,"['Tesla', 'TSLA', 'J.P. Morgan', 'Zacks.com']"
2024-10-03,"Tesla: Ignore The Delivery Miss Noise, Focus On 'We, Robot'","After reporting a wafer-thin deliveries miss for Q3, Tesla stock took a 5%+ tumble in quick order. See why I now rate TSLA stock a Hold.",SeekingAlpha,0.2481,"['Tesla', 'Tesla', 'TSLA']"
2024-10-03,"Market Clubhouse Morning Memo - October 2nd, 2024 (Trade Strategy For SPY, QQQ, AAPL, MSFT, NVDA, GOOGL, META And TSLA)",Looking for stock market analysis and research with proves results? Zacks.com offers in-depth financial research with over 30years of proven results.,Benzinga,0.125,"['SPY', 'QQQ', 'AAPL', 'MSFT', 'NVDA', 'GOOGL', 'META', 'TSLA']"
2024-10-03,Tesla’s (NASDAQ:TSLA) Self-Driving Software Sparks Concerns as Ride-Hail Drivers Push Limits,Looking for stock market analysis and research with proves results? Zacks.com offers in-depth financial research with over 30years of proven results.,TipRanks,0.5,"['Tesla', 'TSLA']"
2024-10-04,TSLA Stock Rises as September Payrolls Beat Expectations,Looking for stock market analysis and research with proves results? Zacks.com offers in-depth financial research with over 30years of proven results.,GuruFocus,0.67,"['TSLA', 'Zacks.com']"
2024-10-04,Tesla’s (NASDAQ:TSLA) CIO Exit Raises Concerns Ahead of Robotaxi Reveal,Looking for stock market analysis and research with proves results? Zacks.com offers in-depth financial research with over 30years of proven results.,TipRanks,0.4012,"['Tesla', 'TSLA', 'Zacks.com']"
2024-10-04,Bank of America Securities Reaffirms Their Buy Rating on Tesla (TSLA),Looking for stock market analysis and research with proves results? Zacks.com offers in-depth financial research with over 30years of proven results.,TipRanks,0.3333,"['Bank of America Securities', 'Tesla', 'TSLA']"
2024-10-04,Tesla: High Hopes Could Meet Harsh Reality Next,"Tesla, Inc.'s Q3 deliveries showed 6% YoY growth, but must post a record Q4 to outperform its 2023 full-year performance. Read more on TSLA stock updates.",SeekingAlpha,0.2481,"['Tesla', ""Tesla, Inc.'s"", 'TSLA']"
2024-10-04,"Market Clubhouse Morning Memo - October 4th, 2024 (Trade Strategy For SPY, QQQ, AAPL, MSFT, NVDA, GOOGL, META And TSLA)",Looking for stock market analysis and research with proves results? Zacks.com offers in-depth financial research with over 30years of proven results.,Benzinga,0.125,"['SPY', 'QQQ', 'AAPL', 'MSFT', 'NVDA', 'GOOGL', 'META', 'TSLA']"
2024-10-04,"Tesla CIO Quits Before Major Robotaxi Event, Exec Departures Continue in 2024","In the latest slew of departures, Tesla Inc (NASDAQ:TSLA) veteran leader quit ahead of its Robotaxi event on October 10 at Warner Bros. Discovery Inc’s (NASDAQ:WBD) movie studio lot in Burbank, California. Chief Information Officer Nagesh Saldi joined Tesla in 2012 from HP Inc (NYSE:HPQ) and gradually became the CIO in 2018. Saldi reported directly to Tesla chief Elon Musk, and Bloomberg cited familiar sources. Also Read: Tesla Recalls 27,185 Cybertruck Vehicles Over Rearview Camera Delay Saldi",Yahoo,0.0586,"['Tesla', 'Robotaxi', 'Tesla Inc', 'NASDAQ', 'TSLA', 'Warner Bros. Discovery Inc’s', 'NASDAQ', 'WBD', 'Tesla', 'HP Inc', 'NYSE', 'HPQ', 'Tesla', 'Bloomberg', 'Tesla']"
2024-10-04,"Tesla (TSLA) Shares Skyrocket, What You Need To Know","Shares of electric vehicle pioneer Tesla (NASDAQ:TSLA) jumped 4.2% in the morning session after equities soared (Nasdaq +0.9%, S&P 500 +0.55%) after The Bureau of Labor Statistics reported nonfarm payrolls for September 2024, which exceeded expectations. Notably, nonfarm payrolls increased by 254,000, significantly surpassing the consensus estimate of 150,000. In addition, the unemployment rate clocked in at 4.1%, slightly below analysts' expectations of 4.2%.",Yahoo,0.4292,"['Tesla', 'TSLA', 'Tesla', 'TSLA', 'The Bureau of Labor Statistics']"
2024-10-04,Is Tesla Inc. (TSLA) The Most Active US Stock To Buy Now?,"We recently compiled a list of 8 Most Active US Stocks To Buy Now. In this article, we will look at where Tesla Inc. (NASDAQ:TSLA) ranks among the most active US stocks to buy now. Market Will Likely Remain Resilient Amid economic uncertainty and upcoming elections, analysts are adopting a cautious stance due to market […]",Yahoo,0.4292,"['Tesla Inc.', 'TSLA', 'Tesla Inc.', 'NASDAQ', 'TSLA']"
2024-10-04,Cathie Wood talks OpenAI investment and Tesla's robotaxi,"OpenAI recently raised $6.6 billion in a new funding round, giving it a valuation of about $157 billion. One firm that has been investing in OpenAI is Ark Invest. Cathie Wood, ARK Invest's CEO and CIO, is betting big on AI. She says OpenAI, along with Anthropic, xAI, Google (GOOG, GOOGL), and Meta Platforms (META) are ""stealing the march"" in the space.  While many investors are concerned about when companies will start seeing returns on their AI investments, Wood is hopeful. When asked about when OpenAI will start to turn a profit, she points to the development of agentic AI, which she thinks will open the door to more profitability, given that companies will be able to charge more for it. Despite some recent executive departures at OpenAI, Wood is confident in the startup's leadership, praising both CEO Sam Altman and CFO Sarah Friar. She notes that ""what we witness in companies that are growing very quickly from startup into scaling is you need a different kind of management team."" When it comes to competition between AI firms, Wood likes it. ""Competition is good. It's going to make this space more competitive and more effective, I think, longer term,"" she says. On the possibility of a company like OpenAI going public, Wood argues ""a lot of companies are staying private longer. They just don't want to deal with the regulation in the public equity markets. And they also don't want to deal with the very short-term oriented or short-term investment time horizon of shareholders in the public equity markets."" However, she does think the public market could become more appealing with interest rates coming down and if investors were willing to stomach the longer-term time horizons some of these companies are working with. Watch the video above to hear Wood discuss Tesla (TSLA) and its upcoming robotaxi event. For more expert insight and the latest market action, click here to watch this full episode of Asking for a Trend. This post was written by Stephanie Mikulich.",Yahoo,0.0475,"['OpenAI', 'Tesla', 'OpenAI', 'OpenAI', 'Ark Invest', ""ARK Invest's"", 'OpenAI', 'Anthropic', 'xAI', 'Google', 'GOOG', 'GOOGL', 'Meta Platforms', 'META', 'OpenAI', 'OpenAI', 'OpenAI', 'Tesla', 'TSLA']"
2024-10-05,Tesla (TSLA) Dominates Norway's Electric Vehicle Market in September,Looking for stock market analysis and research with proves results? Zacks.com offers in-depth financial research with over 30years of proven results.,GuruFocus,0.4012,"['Tesla', 'TSLA', 'Zacks.com']"
2024-10-05,"Tesla, Google, Amazon: Inside the robotaxi market","The launch of Tesla’s (TSLA) robotaxi marks one of the most consequential in the company’s history - if only, because Elon Musk has hailed this as the future for nearly a decade. For eight years, Musk has teased the vision of a shared fleet of fully-autonomous Teslas, with the promise of that technology contributing significantly to the company’s valuation. The long-anticipated launch comes amid increased scrutiny about the promise of self-driving technology. While Google’s Waymo has logged more than 22 million rider miles with few incidents in select cities, accidents involving GM’s Cruise and Tesla’s autopilot technology have raised questions about the technology’s ability to scale safely. Amazon’s Zoox is providing a potential template for the future, building vehicles for the sole purpose of ferrying passengers autonomously, without the traditional controls like a steering wheel and pedals. The company says that their new technology will ensure cost efficiency and safety. Founder Jesse Levinson said that Zoox’s robotaxi is fundamentally different from Tesla’s driver assistance system, as Tesla vehicles require drivers to be ready to take control at any moment.  While Zoox doesn’t rely on human drivers for assistance, the company does use remote operators to guide the vehicle in rare situations.  “The vehicles are only getting help from humans only 1% of the time,” Levinson said. “As it gets more sophisticated, the amount of time they’re asking for help goes down.”  Still, critics question the economics and safety of self-driving taxis, noting that current autonomous rides are more expensive than car ownership, despite being cheaper than traditional rides. While Tesla investors are optimistic about robotaxis, experts believe substantial revenue is still years away.",Yahoo,0.0553,"['Tesla', 'Google', 'Amazon', 'Tesla', 'TSLA', 'Google', 'GM', 'Tesla', 'Amazon', 'Zoox', 'Zoox', 'Tesla', 'Tesla', 'Zoox', 'Tesla']"
2024-10-06,Tesla (TSLA): Among the Most Volatile Stocks to Buy Right Now,"We recently compiled a list of the 10 Most Volatile Stocks To Buy Right Now. In this article, we are going to take a look at where Tesla (NASDAQ:TSLA) stands against the other volatile stocks. Impact of Geopolitics on Investor Psyche and Investment Planning In an interview on Bloomberg on October 2, Jimmy Chang, CIO at […]",Yahoo,0.3759,"['Tesla', 'TSLA', 'Tesla', 'NASDAQ', 'TSLA', 'Bloomberg']"
2024-10-07,"Tesla Stock: We, Are Selling (Rating Downgrade)",Underwhelming vehicle delivery numbers and the departure of the CIO have Tesla shares dropping. Read why TSLA stock should be dropped for the time being.,SeekingAlpha,0.2481,"['Tesla', 'Tesla', 'TSLA']"
2024-10-07,"Musk vs. Buffett: Which Investor Do Benzinga Readers Trust To Turn $1,000 Into $100,000 Faster?","A new Benzinga poll pitted Warren Buffett, Elon Musk, and other renowned investors against each other, asking readers to decide who they would trust to turn $1,000 into $100,000 the fastest based on their past and current investment track records. What Happened: Elon Musk has helped transform SpaceX and Tesla Inc (NASDAQ:TSLA) into two of the most valuable companies in the world, which might explain why investors continue to believe in his companies and future growth initiatives. Don’t Miss: One",Yahoo,0.1658,"['Benzinga', 'Benzinga', 'SpaceX', 'Tesla Inc', 'TSLA']"
2024-10-07,"Tesla: After Missing Q3 Deliveries, I Remain Unfazed By The Robotaxi Hype","Tesla's 3Q FY2024 deliveries missed expectations, signaling potential muted 3Q earnings. Read why I remain very bearish on TSLA stock.",SeekingAlpha,0.2481,"['Tesla', 'Tesla', 'TSLA']"
