date,headline,summary,source,relevance,entities
2025-04-04,"Tesla, Inc. (TSLA) is Attracting Investor Attention: Here is What You Should Know","Tesla (TSLA) has been one of the stocks most watched by Zacks.com users lately. So, it is worth exploring what lies ahead for the stock.",Yahoo,0.7167,"['Tesla, Inc.', 'TSLA', 'Tesla', 'TSLA', 'Zacks.com']"
2025-04-04,Tesla stock sinks as analysts say 'unprecedented' brand damage could hurt earnings,"The effects of Tesla’s (TSLA) “unprecedented” brand damage have surprised even analysts at J.P. Morgan (JPM), who had already described the backlash against CEO Elon Musk as without equal in the history of the automotive industry.",Yahoo,0.1658,"['Tesla', 'Tesla', 'TSLA', 'J.P. Morgan', 'JPM']"
2025-04-04,Analyst Cuts Tesla (TSLA) Price Target Amid ‘Commoditized” FSD Product,"We recently published a list of 10 Stocks Everyone is Talking About After Trump’s New Tariffs. In this article, we are going to take a look at where Tesla Inc (NASDAQ:TSLA) stands against other stocks everyone is talking about after Trump’s new tariffs. Countries are beginning to react to President Donald Trump’s new reciprocal tariffs […]",Yahoo,0.5,"['Tesla', 'TSLA', 'Tesla Inc', 'TSLA']"
2025-04-04,Magnificent 7 are all negative under Trump 2.0,"All ""Magnificent Seven"" names — Nvidia (NVDA), Alphabet (GOOG, GOOGL), Tesla (TSLA), Microsoft (MSFT), Amazon (AMZN), Meta (META), and Apple (AAPL) — are in the red under Trump's second administration. Yahoo Finance podcast Stocks in Translation host Jared Blikre takes a closer look at the group's moves. Catch more Stocks in Translation here, with new episodes every Tuesday and Thursday. To watch more expert insights and analysis on the latest market action, check out more Catalysts here.",Yahoo,0.0625,"['Nvidia', 'NVDA', 'Alphabet', 'GOOG', 'GOOGL', 'Tesla', 'TSLA', 'Microsoft', 'MSFT', 'Amazon', 'AMZN', 'Meta', 'META', 'Apple', 'AAPL', 'Yahoo Finance']"
2025-04-04,Tesla Is Transitioning For Industry 4.0 (Rating Upgrade),"Tesla, Inc. stock faces short-term challenges but holds strong long-term potential with its robotaxi program and robotics development. Click for my TSLA update.",SeekingAlpha,0.4962,"['Tesla', 'Tesla, Inc.', 'TSLA']"
2025-04-04,"Cathie Wood Just Made A Bold Move—Why She Spent Over $65M On Tesla, Robinhood, And Coinbase 'As The Market Crashed'","The stock market took a dive, but Cathie Wood didn’t flinch. Instead of retreating, the Ark Invest CEO saw an opportunity and went on a buying spree. According to Investor’s Business Daily, her firm snapped up shares of Tesla (NASDAQ:TSLA), Robinhood (NASDAQ:HOOD), Coinbase (NASDAQ:COIN), Palantir Technologies (NYSE:PLTR), and more on March 10. Big Bets in a Turbulent Market Investor’s Business Daily said that Ark Invest picked up 79,318 shares of Tesla, valued at $17.62 million based on Monday’",Yahoo,0.0553,"['Tesla', 'Robinhood', 'Coinbase', 'Ark Invest', 'Investor’s Business Daily', 'Tesla', 'TSLA', 'Robinhood', 'HOOD', 'Coinbase', 'COIN', 'Palantir Technologies', 'PLTR', 'Ark Invest', 'Tesla']"
2025-04-04,Analyst on Tesla (TSLA): Democrats Getting ‘Turned Off’ By Elon Musk’s ‘Antics’,"We recently published a list of Top 10 Stocks to Watch as Investors Brace for Potential Recession. In this article, we are going to take a look at where Tesla, Inc. (NASDAQ:TSLA) stands against other top stocks to watch as investors brace for potential recession. President Donald Trump’s new reciprocal tariff announcement is hammering stock […]",Yahoo,0.5708,"['Tesla', 'TSLA', 'Tesla, Inc.', 'NASDAQ', 'TSLA']"
2025-04-05,Tesla (TSLA) Faces Skepticism as AI-Driven Autonomy Hits Roadblocks,"We recently published a list of Mag7 and Beyond: Top 10 AI News Updates and Ratings. In this article, we are going to take a look at where Tesla, Inc. (NASDAQ:TSLA) stands against other top AI news updates and ratings. According to a study presented at a European Central Bank conference, companies that manage to […]",Yahoo,0.5,"['Tesla', 'TSLA', 'Tesla, Inc.', 'NASDAQ', 'TSLA', 'European Central Bank']"
2025-04-05,3 No-Brainer Stocks With Long-Term Prospects to Buy With $100 Right Now,"If my guess is right, I think the long-term trends behind contract logistics provider GXO Logistics (NYSE: GXO), electric vehicle (EV) company Tesla (NASDAQ: TSLA), and copper miner Freeport-McMoRan (NYSE: FCX) make them compelling buys right now.  GXO Logistics offers its customers a route to outsourcing their supply chain logistics, specifically e-commerce warehousing.  Outsourcing logistics allows companies to focus time and effort on their core activity.",Yahoo,0.125,"['GXO Logistics', 'NYSE', 'GXO', 'Tesla', 'TSLA', 'Freeport-McMoRan', 'FCX', 'GXO Logistics']"
2025-04-05,"Trump tariffs hammer stocks, recession fears rise, Tesla after Elon Musk's DOGE days: Markets news roundup","Despite taking a hit earlier in the day from weak deliveries, Tesla (TSLA) stock is now soaring as Elon Musk’s time in the federal government appears to be nearing an end.",Yahoo,0.2481,"['Tesla', 'Tesla', 'TSLA']"
2025-04-05,"Tesla, Inc. (TSLA): Among Stocks That Will Profit From AI","We recently published a list of 10 Stocks That Will Profit From AI. In this article, we are going to take a look at where Tesla, Inc. (NASDAQ:TSLA) stands against other stocks that will profit from AI. Artificial Intelligence (AI) is no longer a concept of the future but a real economic force influencing markets. […]",Yahoo,0.8584,"['Tesla, Inc.', 'TSLA', 'Tesla, Inc.', 'NASDAQ', 'TSLA']"
2025-04-05,Jim Cramer on Tesla (TSLA): ‘You Gotta Rely on the Tech Side – Auto Pain Isn’t Over’,"We recently published a list of Jim Cramer Raises Big Question About Tariffs & Discusses These 11 Stocks. In this article, we are going to take a look at where Tesla, Inc. (NASDAQ:TSLA) stands against other stocks that Jim Cramer discusses. In a recent appearance on CNBC’s Squawk on the Street, Jim Cramer asked the […]",Yahoo,0.5708,"['Tesla', 'TSLA', 'Tesla, Inc.', 'TSLA', 'CNBC']"
2025-04-06,Autonomous Driving And Retail Trader Buying Won't Steer Tesla's Stock Price,Cathie Wood has recently predicted that Tesla will reach $2600/share in five years' time. See why I reiterate my strong sell rating on TSLA stock.,SeekingAlpha,0.2481,"['Tesla', 'Tesla', 'TSLA']"
2025-04-06,Tesla: Gap With BYD Might Be Uncoverable,"Tesla's stock continues to be overvalued, facing competition from BYD and a narrow model lineup that limits its moat. Find out why TSLA stock is a Strong Sell.",SeekingAlpha,0.1416,"['Tesla', 'BYD', 'Tesla', 'BYD', 'TSLA']"
2025-04-06,Tesla: Don't Buy The Dip,"Tesla's valuation remains high after the 50% selloff since December, trading at 117 times last year's earnings. See why I rate TSLA stock a sell.",SeekingAlpha,0.2481,"['Tesla', 'Tesla', 'TSLA']"
2025-04-07,Tesla: More Short-Term Pain Before Long-Term Gains From The Next Industrial Revolution,"Tesla is poised for long-term growth in AI and robotics, even amid short-term challenges. Read why TSLA stock is a hold for long-term investors.",SeekingAlpha,0.2481,"['Tesla', 'Tesla', 'TSLA']"
2025-04-07,"Tesla's Trouble Worsens Amid New Tariffs, Wedbush Says",Tesla's (TSLA) troubles have intensified with the imposition of new economic tariffs by the Trump Ad,Yahoo,0.2481,"['Tesla', 'Tesla', 'TSLA']"
2025-04-07,Well-Known Analyst Slashes His Price Target on Tesla (TSLA) Stock,"Dan Ives, a renowned analyst at investment bank Wedbush Securities, cut his price target on Tesla (TSLA) today to $315 from $550, Schwab Network reported. However, Ives did keep an Outperform rating on the name. Why Ives Sharply Lowered His Price Target President Donald Trump’s tariffs, which Ives called “economic…Armageddon,” will create “a double whammy” […]",Yahoo,0.3759,"['Tesla', 'TSLA', 'Wedbush Securities', 'Tesla', 'TSLA', 'Schwab Network']"
2025-04-07,Tesla stock slips. A big Wall Street bull says Elon Musk faces 'a pivotal moment of truth',"Tesla (TSLA) stock was falling yet again Monday, down more than 3% in morning trading as markets headed for another brutal day in the wake of President Donald Trump’s sweeping tariffs.",Yahoo,0.2481,"['Tesla', 'Tesla', 'TSLA']"
2025-04-07,Technical Analyst Identifies Important Levels for Tesla (TSLA),"Two important levels for Tesla (TSLA) stock at this point are $208 and $220, Rick Ducat, the Schwab Network’s Lead Market Technician said on the network today. Meanwhile, another Schwab commentator, Tom White, unveiled a bearish options trade on TSLA stock. The Key Levels for TSLA Stock “The $208 level held up for a long […]",Yahoo,0.5,"['Tesla', 'TSLA', 'Tesla', 'TSLA', 'the Schwab Network’s', 'Schwab', 'TSLA', 'TSLA']"
2025-04-07,Shorting Tesla: Interest-Free Loans In China Are A Sign Of Desperation,"Explore why Tesla, Inc.'s brand image is faltering and its struggles with valuation, declining sales, and competition. Click for more on TSLA stock prospects.",SeekingAlpha,0.2481,"['Tesla', ""Tesla, Inc.'s"", 'TSLA']"
2025-04-07,Tesla's Supercharger Business to Power Up its Long-Term Story,"TSLA's Supercharger network is growing fast, now spanning 65k+ stalls. With NACS adoption and wider access, it's cementing Tesla's position in EV charging.",Yahoo,0.2481,"['Tesla', 'TSLA', 'Tesla']"
2025-04-07,"Tesla Will Survive A Trade War, But A Taiwan Conflict Would Be Perilous","Tesla, Inc.'s Gigafactories offset tariff risks, but reliance on China & Taiwan poses supply vulnerabilities. Click for my updated look at TSLA stock prospects.",SeekingAlpha,0.2481,"['Tesla', ""Tesla, Inc.'s"", 'TSLA']"
2025-04-07,Tesla Has Over $200 Million Worth Of Cybertrucks In Inventory—And That's Raising Questions About Demand (Again),"Tesla (NASDAQ:TSLA) is sitting on nearly 2,400 unsold Cybertrucks across the U.S., according to new data from Tesla-Info. That's about $200 million worth of inventory for a vehicle CEO Elon Musk once said had “over 1 million” reservations. But more than a year after deliveries began, the Cybertruck has become a tough sell. Sluggish Sales, Rising Inventory When the Cybertruck was first unveiled in 2019, Musk said it would start at $39,900. But the base model came out at $60,990, and early Foundat",Yahoo,0.1658,"['Tesla', 'Tesla', 'NASDAQ', 'TSLA', 'Tesla-Info']"
2025-04-07,Tesla (TSLA) Faces AI Growth Headwinds as JPMorgan Cuts EPS Forecast,"We recently published a list of Tariff Hits and More: 10 AI Stocks in the Spotlight. In this article, we are going to take a look at where Tesla, Inc. (NASDAQ:TSLA) stands against other AI stocks in the spotlight. The newly announced tariffs by U.S. President Donald Trump could have serious consequences for many stocks. […]",Yahoo,0.4433,"['Tesla', 'TSLA', 'JPMorgan', 'Tesla, Inc.', 'NASDAQ', 'TSLA']"
2025-04-07,Tesla Isn't A Leader Anymore,"Tesla, Inc. lost its EV crown to BYD amid brand challenges and competition. Click here to read more on market risks, TSLA stock insights, and levels to watch before investing.",SeekingAlpha,0.3976,"['Tesla', 'Tesla, Inc.', 'BYD', 'TSLA']"
2025-04-08,More Trouble For Tesla: This Isn't A Dip. It's A Cliff,"Tesla shares dropped 10%, as weakening fundamentals, declining demand, and stiff competition from BYD and Lucid intensify. Read why I reiterate my strong sell thesis on TSLA.",SeekingAlpha,0.1658,"['Tesla', 'Tesla', 'BYD', 'Lucid', 'TSLA']"
2025-04-08,Tesla Is Our Highest Conviction Long In The Tariff Fallout (Rating Upgrade),"Explore why Tesla, Inc.'s current valuation presents potential upside despite weak auto demand and tariff disruptions. Click for our updated look at TSLA prospects.",SeekingAlpha,0.2481,"['Tesla', ""Tesla, Inc.'s"", 'TSLA']"
2025-04-08,"Musk despises Navarro, architect of Trump’s trade war","Investing.com -- Illustrating signs of cracks in the upper echelons of the Trump administration, Tesla (NASDAQ:TSLA) CEO and DOGE chief Elon Musk continues to lash out publicly at key Trump advisor and tariff architect Peter Navarro, calling him a ""moron.""",Yahoo,0.25,"['Tesla', 'NASDAQ', 'TSLA', 'DOGE']"
2025-04-08,"Tesla, Amazon, and Apple forfeit gains after fleeting Magnificent 7 stock rally","The trade-war selloff took a breather earlier on Tuesday, buoying Big Tech firms including Nvidia (NVDA), Tesla (TSLA), Meta (META), and Microsoft (MSFT), after a mixed day on Monday and two especially gnarly days last week wiped $1.8 trillion off the market value of leading tech stocks.",Yahoo,0.071,"['Tesla', 'Amazon', 'Apple', 'Nvidia', 'NVDA', 'Tesla', 'TSLA', 'Meta', 'META', 'Microsoft', 'MSFT']"
2025-04-08,Market Chatter: Used Tesla Price Falling Faster Than Other Used EVs,"Tesla (TSLA) used car prices in the US and UK fell sharply during March, outpacing a dip in the pric",Yahoo,0.2481,"['Tesla', 'Tesla', 'TSLA']"
2025-04-08,Elon Musk's Net Worth Dives Below $300 Billion For The First Time Since November Amid Tesla Attacks And Tariff Woes,"Elon Musk, the CEO of Tesla Inc. (NASDAQ:TSLA), has seen his net worth plunge below the $300 billion mark. This significant decrease is linked to the ongoing backlash against Tesla and the implementation of new tariffs. What Happened: Musk’s net worth ...",Yahoo,0.1988,"['Tesla', 'Tesla Inc.', 'TSLA', 'Tesla']"
2025-04-09,Tesla Stock (TSLA) Pain Set to Endure Under Elon Musk’s Leadership,"Tesla (TSLA) stock has hit a roadblock in the past three years, and investors are growing wary of CEO Elon Musk and his impact on Tesla’s brand. Earlier this month, the American electric vehicle (EV) giant reported 336,681 cars delivered in Q1 2025, representing a 13% year-over-year decline from Q1 2024. The figure missed analyst expectations of 370,000 vehicles and prompted a JPMorgan analyst to reiterate an Underweight rating on Tesla and express concerns over “unprecedented brand damage.” As",Yahoo,0.3344,"['Tesla', 'TSLA', 'Tesla', 'TSLA', 'Tesla', 'JPMorgan', 'Tesla']"
2025-04-09,Elon Musk Vs. Trump: Tesla's CEO Draws The Line On Tariffs (Rating Upgrade),"Learn how Trump's tariffs could impact Tesla, Inc.'s prices, costs, and market positioning. Click as I analyze TSLA investment strategies amid challenges.",SeekingAlpha,0.2481,"['Tesla', ""Tesla, Inc.'s"", 'TSLA']"
2025-04-09,Why Tesla Is A High-Stakes Gamble Now,"Tesla, Inc.'s stock struggles, with declining sales, global competition, and brand risks. Click here to find out why TSLA stock is a Hold.",SeekingAlpha,0.2481,"['Tesla', ""Tesla, Inc.'s"", 'TSLA']"
2025-04-09,Tesla (TSLA) Added to Investment Bank’s Best Ideas List,"Investment bank Benchmark added Tesla (TSLA) to its Best Ideas List but cut its price target on the shares to $350 from $475, Schwab Network reported today. Benchmark believes that the recent decline of the stock has been “overdone.” Why Benchmark Is Bullish on TSLA Benchmark, which kept a Buy rating on TSLA, believes that […]",Yahoo,0.286,"['Tesla', 'TSLA', 'Investment Bank’s', 'Benchmark', 'Tesla', 'TSLA', 'Schwab Network', 'Benchmark', 'Benchmark', 'TSLA Benchmark', 'TSLA']"
2025-04-09,"Tesla’s (TSLA) Risk/Reward Ratio Is Positive, Analyst says","Much of “the negative sentiment towards Tesla (TSLA) is priced into the stock at its current levels,” CFRA analyst Garrett Nelson told Schwab Network recently. Nelson believes that the shares can reach $360 in 12 months. Q1 Was Likely the Low Point for Tesla’s Sales, Nelson Says Tesla’s auto sales likely bottomed last quarter, as […]",Yahoo,0.3012,"['Tesla', 'TSLA', 'Tesla', 'TSLA', 'CFRA', 'Schwab Network', 'Tesla', 'Tesla']"
2025-04-09,Why Tesla Stock Is Soaring Today Even as Tariff Trouble Mounts,"Shares of Tesla (NASDAQ: TSLA) are rebounding on Wednesday.  The bounce comes as the S&P 500 and Nasdaq Composite were green even as more retaliatory tariffs on the U.S. were announced.  A Wall Street firm added Tesla to its ""best ideas"" list despite recent troubles, claiming the stock sell-off is overdone.",Yahoo,0.1658,"['Tesla', 'Tesla', 'NASDAQ', 'TSLA', 'Tesla']"
2025-04-09,Why Are Tesla (TSLA) Shares Soaring Today,"Shares of electric vehicle pioneer Tesla (NASDAQ:TSLA) jumped 17% in the afternoon session after markets rallied sharply on news that President Trump announced a 90-day tariff pause. Reciprocal tariffs were also dropped to 10% for most countries, sparking renewed optimism amid ongoing trade talks. The major stock indices rose as investors, growing impatient of seemingly irrational tariff actions, welcomed the pause as a sign of a more measured path forward.",Yahoo,0.5,"['Tesla', 'TSLA', 'Tesla', 'TSLA']"
2025-04-09,Tesla (TSLA) Holds Strong Despite Tariff Pressures as Wedbush Reiterates “Outperform”,"We recently published a list of 9 AI Stocks In Focus: Tariffs and Key Updates. In this article, we are going to take a look at where Tesla, Inc. (NASDAQ:TSLA) stands against other AI stocks in focus. President Donald Trump’s new tariff regimes have been introduced under the International Emergency Economic Powers Act. A 10% […]",Yahoo,0.4981,"['Tesla', 'TSLA', 'Wedbush', 'Tesla, Inc.', 'TSLA']"
2025-04-09,Why Tesla Stock Is Skyrocketing Today,"Tesla (NASDAQ: TSLA) stock is soaring today amid a big rebound rally for the broader market.  The company's share price was up 18.5% as of 3 p.m. ET.  Meanwhile, the S&P 500 index was up 7.2%, and the Nasdaq Composite index was up 9.7%.",Yahoo,0.1988,"['Tesla', 'Tesla', 'NASDAQ', 'TSLA']"
2025-04-09,1 Wall Street Analyst Just Slashed Tesla's Price Target by More Than 40%. Is It Time to Sell the Stock?,"Tesla (NASDAQ: TSLA) CEO Elon Musk may have a seat at the table in the Trump administration, but his company's stock hasn't been immune to the market carnage initiated by the administration's trade policies.  Tesla shares are down more than 40% year to date, including a double-digit drop since President Trump announced his global tariff plans on April 2.  Wedbush analyst Dan Ives slashed his price target on Tesla stock from $550 to $315 per share.",Yahoo,0.1422,"['Tesla', 'Tesla', 'TSLA', 'Tesla', 'Wedbush', 'Tesla']"
2025-04-10,Is Lucid Eating Tesla's Lunch?,"The automotive industry is highly loyal, and one of the biggest challenges is ""conquesting"" consumers, which is simply one brand taking a customer from another.  Since Tesla (NASDAQ: TSLA) vehicles hit the roads, the company has thoroughly dominated the U.S. market in sales volumes, but a recent backlash against the once unflappable brand may have sent consumers fleeing to a competitor you might not expect: Lucid (NASDAQ: LCID).  Lucid's interim CEO made some very intriguing comments recently, and investors should take note of them.",Yahoo,0.0904,"['Lucid', 'Tesla', 'Tesla', 'NASDAQ', 'TSLA', 'Lucid', 'NASDAQ', 'LCID', 'Lucid']"
2025-04-10,"Tesla: Load Up, Buckle In, And Ignore The Bears",Tesla's well-diversified manufacturing footprint and solid profitability is well-positioned to navigate the tariff headwinds. See why I remain bullish on TSLA.,SeekingAlpha,0.2481,"['Tesla', 'Tesla', 'TSLA']"
2025-04-10,"Tesla's Damage Isn't Irreversible, But A Rebound Won't Come Easily (Upgrade)","Tesla, Inc.'s stock faces risks with declining market share and tariffs, but the upcoming Model Q launch may shift the narrative. Click for my TSLA stock update.",SeekingAlpha,0.2481,"['Tesla', ""Tesla, Inc.'s"", 'TSLA']"
2025-04-10,"Tesla (TSLA) Is Still the Top Pick – AI, Robotics, and Energy Drive the Future","We recently published a list of 10 AI Stocks Investors Are Watching Today. In this article, we are going to take a look at where Tesla, Inc. (NASDAQ:TSLA) stands against other AI stocks investors are watching today. Tech experts strongly believe that the new tariffs could potentially slow down the AI boom. “The AI Revolution […]",Yahoo,0.665,"['Tesla', 'TSLA', 'Tesla, Inc.', 'TSLA']"
2025-04-10,"Tesla (TSLA) Stuns Wall Street with 22% Rally, Marks Best Day Since 2013",Tesla Soars on Tariff Relief as Market Follows,Yahoo,0.4012,"['Tesla', 'TSLA', 'Tesla']"
2025-04-10,"GM, Tesla, & Ford; Nike falls; CarMax outlook: Trending Tickers","Brad Smith and Madison Mills take a closer look at some of the trending tickers in premarket trading. UBS analysts downgrade General Motors (GM) to Neutral from Buy and cut their price target for Tesla (TSLA), while Goldman Sachs downgrades Ford (F) to Neutral from Buy. Nike (NKE) and Lululemon (LULU) fall, retreating from broad tariff pause highs, as investors assess the impact of increased tariffs on imports from China on retailers. CarMax (KMX) pulls its long-term sales forecast, citing macro-level uncertainty. To watch more expert insights and analysis on the latest market action, check out more Morning Brief here.",Yahoo,0.0432,"['GM', 'Tesla', 'Ford', 'Nike', 'CarMax', 'UBS', 'General Motors', 'GM', 'Tesla', 'TSLA', 'Goldman Sachs', 'Ford', 'Nike', 'NKE', 'Lululemon', 'LULU', 'CarMax', 'KMX']"
2025-04-10,"UBS Cuts Price Target on Tesla (TSLA), Downgrades GM","UBS today lowered its price target on Tesla (TSLA) to $190 from $225 while reiterating a Sell rating on the shares. The Swiss bank also downgraded GM (GM) to Neutral from Buy. Why UBS Has Become More Bearish on TSLA Although many institutions have lowered their estimates for Tesla this year, the estimates may be […]",Yahoo,0.25,"['UBS', 'Tesla', 'TSLA', 'GM', 'UBS', 'Tesla', 'TSLA', 'GM', 'GM', 'UBS', 'TSLA', 'Tesla']"
2025-04-10,"Tesla in Saudi Arabia, TSM sales, Amazon CEO: Trending Tickers","Madison Mills outlines some of today's trending tickers. Tesla (TSLA) stock is in focus after the company opened its first showroom in Saudi Arabia. Taiwan Semiconductor Manufacturing Company (TSM) sales jumped 42% in the first quarter as customers stocked up ahead of President Trump's tariffs. Amazon (AMZN) CEO Andy Jassy tells CNBC that third-party sellers will likely pass increased tariff-associated costs on to consumers. To watch more expert insights and analysis on the latest market action, check out more Catalysts here.",Yahoo,0.0764,"['Tesla', 'TSM', 'Amazon', 'Tesla', 'TSLA', 'Taiwan Semiconductor Manufacturing Company', 'TSM', 'Amazon', 'AMZN', 'CNBC']"
2025-04-10,Why Tesla Stock Is Plummeting Today,"Shares of Tesla (NASDAQ: TSLA) are falling on Thursday.  The slip comes as the S&P 500 and Nasdaq Composite lost 4.2% and 5.3%, respectively.  UBS lowered its price target for Tesla stock citing concerns with its energy business in China.",Yahoo,0.1658,"['Tesla', 'Tesla', 'TSLA', 'UBS', 'Tesla']"
2025-04-10,Jim Cramer Slams Tesla (TSLA)’s Valuation and Calls Auto Business ‘Collapsed’,"We recently published a list of Jim Cramer Calls Market Decline ‘Man-Made’ and Breaks Down 15 Stocks. In this article, we are going to take a look at where Tesla, Inc. (NASDAQ:TSLA) stands against other stocks that Jim Cramer discusses. On Monday, April 7th, Jim Cramer opened the Mad Money episode with a message of […]",Yahoo,0.665,"['Tesla', 'TSLA', 'Tesla, Inc.', 'TSLA']"
2025-04-10,Mag 7 market cap value surged on tariff pause news,"The ""Magnificent Seven,"" made up of Nvidia (NVDA), Alphabet (GOOG, GOOGL), Tesla (TSLA), Microsoft (MSFT), Amazon (AMZN), Meta (META), and Apple (AAPL), added over $1.8 trillion to their market capitalizations during the tariff pause–fueled stock rally on Wednesday. In this episode of Stocks in Translation, podcast host Jared Blikre dives deeper into the latest price action for large-cap tech names. Catch more Stocks in Translation here, with new episodes every Tuesday and Thursday. To watch more expert insights and analysis on the latest market action, check out more Catalysts here.",Yahoo,0.0625,"['Nvidia', 'NVDA', 'Alphabet', 'GOOG', 'GOOGL', 'Tesla', 'TSLA', 'Microsoft', 'MSFT', 'Amazon', 'AMZN', 'Meta', 'META', 'Apple', 'AAPL', 'Stocks in Translation']"
2025-04-10,Bearish Options Play on Tesla Unveiled by TSLA Skeptic,"OptionsPlay analyst Tony Zhang, who’s very pessimistic about Tesla (TSLA) and its stock, unveiled a bearish options play on the name today on the Schwab Network. Why Zhang Is Bearish on TSLA Stock Tesla’s valuation is “incredibly rich,” and the automaker is losing market share to its Chinese competitors in Europe, Asia, and the U.S., […]",Yahoo,0.4448,"['Tesla', 'TSLA', 'Tesla', 'TSLA', 'the Schwab Network', 'TSLA', 'Tesla']"
2025-04-10,Tesla Is Plummeting Again -- Is It Time to Buy the Stock?,"On the heels of huge gains yesterday, Tesla (NASDAQ: TSLA) stock is seeing big sell-offs in Thursday's trading.  While President Donald Trump issued a 90-day suspension of reciprocal tariffs for other countries yesterday, he announced that the import tax rate on products from China would be raised from 104% to 125%.  As of this writing, Tesla stock is now down 39% across 2025's trading and 48% from its valuation peak.",Yahoo,0.1658,"['Tesla', 'Tesla', 'NASDAQ', 'TSLA', 'Tesla']"
2025-04-10,Here's what's up with Tesla's slippery stock price today,"Tesla (TSLA) stock took another dive on Thursday as analysts chopped price targets for the electric-vehicle maker, citing the Trump administration’s impending 25% tariffs on auto parts and weakening demand in Europe and China.",Yahoo,0.2481,"['Tesla', 'Tesla', 'TSLA']"
2025-04-10,Why Tesla (TSLA) Shares Are Trading Lower Today,"Shares of electric vehicle pioneer Tesla (NASDAQ:TSLA) fell 10.7% in the afternoon session after Wall Street sentiment toward the company turned more bearish, with several analysts cutting their forecasts and price targets. UBS analyst Joseph Spak issued the most bearish outlook, slashing his price target to $190, implying a potential 30% downside. Spak warned that while lower 2025 earnings expectations were becoming consensus, the broader earnings trajectory for Tesla still appeared overly opti",Yahoo,0.3759,"['Tesla', 'TSLA', 'Tesla', 'TSLA', 'UBS', 'Tesla']"
